    Show_Id,Category,Title,Director,Cast,Country,Release_Date,Rating,Duration,Type,Description,Duration_Minutes
s68,Movie,13TH: A Conversation with Oprah Winfrey & Ava DuVernay,,"Oprah Winfrey, Ava DuVernay",,"January 26, 2017",,37 min,Movies,"Oprah Winfrey sits down with director Ava DuVernay to discuss her Oscar-nominated film, historical cycles of oppression and the broken prison system.",37.0
s101,Movie,3 Idiots,Rajkumar Hirani,"Aamir Khan, Kareena Kapoor, Madhavan, Sharman Joshi, Omi Vaidya, Boman Irani, Mona Singh, Javed Jaffrey",India,"August 1, 2019",PG-13,164 min,"Comedies, Dramas, International Movies","While attending one of India's premier colleges, three miserable engineering students and best friends struggle to beat the school's draconian system.",164.0
s147,Movie,A 3 Minute Hug,Everardo González,,"Mexico, United States","October 28, 2019",TV-PG,28 min,"Documentaries, International Movies",This documentary captures the joy and heartbreak of families separated by the U.S.-Mexico border sharing a short but bittersweet reunion in 2018.,28.0
s154,Movie,A Bridge Too Far,Richard Attenborough,"Dirk Bogarde, James Caan, Michael Caine, Sean Connery, Edward Fox, Elliott Gould, Gene Hackman, Anthony Hopkins, Hardy Krüger, Laurence Olivier, Ryan O'Neal, Robert Redford, Maximilian Schell, Liv Ullmann","United States, United Kingdom","July 1, 2020",PG,176 min,"Action & Adventure, Classic Movies, Dramas",This wartime drama details a pivotal day in 1944 when an Allied task force tried to win World War II by seizing control of key bridges in Holland.,176.0
s163,Movie,A Christmas Special: Miraculous: Tales of Ladybug & Cat Noir,Thomas Astruc,"Cristina Vee, Bryce Papenbrook, Keith Silverstein, Mela Lee, Max Mittelman, Carrie Keranen, Stephanie Sheh, Selah Victor, Ben Diskin, Erin Fitzgerald, Grant George","France, South Korea, Japan","December 20, 2016",TV-Y7,22 min,Movies,Parisian teen Marinette transforms herself into superhero Ladybug to find her lonely secret crush Adrien when he runs away from home at Christmas.,22.0
s172,Movie,A Family Reunion Christmas,Robbie Countryman,"Loretta Devine, Tia Mowry-Hardrict, Anthony Alabi, Talia Jackson, Isaiah Russell-Bailey, Cameron J. Wright, Jordyn Raya James, Jackée Harry, Richard Roundtree",United States,"December 9, 2019",TV-PG,29 min,Movies,M'Dear and her sisters struggle to keep their singing act together before a church Christmas pageant while Grandpa teaches the kids a valuable lesson.,29.0
s174,Movie,A Fortunate Man,Bille August,"Esben Smed, Katrine Rosenthal, Benjamin Kitter, Julie Christiansen, Tommy Kenter, Tammi Øst, Rasmus Bjerg, Ole Lemmeke, Sarah Viktoria Bjerregaard, Anders Hove, Jens Albinus",Denmark,"April 20, 2019",TV-MA,168 min,"Dramas, International Movies","A gifted engineer flees his austere roots to pursue wealth and success among Copenhagen's elite, but the pride propelling him threatens to be his ruin.",168.0
s178,Movie,A Go! Go! Cory Carson Christmas,"Stanley Moore, Alex Woo","Alan C. Lim, Taron C. Hensley, Maisie Benson, Kerry Gudjohnsen, Paul Killam, Smith Foreman, Ann Kendrick, Ella Joy Ballesteros, Neena-Sinaii Simpo, Eli Morse",United States,"November 27, 2020",TV-Y,22 min,Children & Family Movies,"When a familiar-looking stranger crashes in without a memory, Cory helps him remember the magic of Christmas to save the holiday for everyone.",22.0
s179,Movie,A Go! Go! Cory Carson Halloween,"Alex Woo, Stanley Moore","Alan C. Lim, Smith Foreman, Maisie Benson, Ann Kendrick, Kerry Gudjohnsen, Paul Killam, Stanley Moore, Tyler Hendrix, Ella Joy Ballesteros, Jimmy Olea",,"October 2, 2020",TV-Y,22 min,Children & Family Movies,"Cory, Chrissy and Freddie are on the hunt for king-sized candy bars this Halloween! But are all the treats worth the trek to the spooky side of town?",22.0
s180,Movie,A Go! Go! Cory Carson Summer Camp,"Stanley Moore, Alex Woo","Alan C. Lim, Smith Foreman, Abigail Vibat, Pfifer Chastain, Jim Capobianco, Neena-Sinaii Simpo, Eli Morse, Adelaide Hirasaki, Paul Killam, Kerry Gudjohnsen, Maisie Benson",,"August 4, 2020",TV-Y,21 min,Children & Family Movies,"Cory's spending the summer at Camp Friendship with his best friend, Freddie. But jealousy flares when Freddie brings his cousin Rosie along for the ride.",21.0
s201,Movie,A Love Song for Latasha,Sophia Nahli Allison,,United States,"September 21, 2020",TV-PG,20 min,Documentaries,The killing of Latasha Harlins became a flashpoint for the 1992 LA uprising. This documentary evocatively explores the 15-year-old's life and dreams.,20.0
s234,Movie,A StoryBots Christmas,"Evan Spiridellis, Jeff Gill","Edward Asner, Judy Greer, Erin Fitzgerald, Fred Tatasciore, Jeff Gill, Gregg Spiridellis, Evan Spiridellis, Jim Meskimen, Nate Theis",United States,"December 1, 2017",TV-Y,26 min,"Children & Family Movies, Comedies","Bo thinks her holiday gift-giving isn't good enough, so she heads north to study under Santa Claus – only to find he's missing.",26.0
s238,Movie,A Tale of Two Kitchens,Trisha Ziff,,"United States, Mexico","May 22, 2019",TV-PG,30 min,"Documentaries, International Movies","Mexico City restaurant star Gabriela Cámara opens sister eatery Cala in San Francisco, with a similar menu and unusually welcoming kitchen culture.",30.0
s243,Movie,A Trash Truck Christmas,Eddie Rosas,"Henry Keane, Glen Keane, Lucas Neff, Brian Baumgartner, Jackie Loeb, John DiMaggio",,"December 11, 2020",TV-Y,28 min,Children & Family Movies,"When Santa crash-lands in the junkyard on Christmas Eve, Hank, Trash Truck and their animal friends all have a hand in rescuing the holiday for everyone.",28.0
s272,Movie,Aarakshan,Prakash Jha,"Amitabh Bachchan, Saif Ali Khan, Manoj Bajpayee, Deepika Padukone, Prateik, Tanvi Azmi, Saurabh Shukla, Darshan Jariwala, Yashpal Sharma, Mukesh Tiwari",India,"December 31, 2019",TV-14,164 min,"Dramas, International Movies",The decision by India's supreme court to establish caste-based reservations for jobs in education causes conflict between a teacher and his mentor.,164.0
s296,Movie,Across Grace Alley,Ralph Macchio,"Ben Hyland, Marsha Mason, Karina Smirnoff, Colin Branca, Ralph Macchio, Tricia Paoluccio",United States,"December 1, 2016",TV-PG,24 min,Dramas,"A young boy, upset by his parents' divorce, becomes infatuated with his grandmother's neighbor, an entrancing dancer he watches through a window.",24.0
s326,Movie,After Maria,Nadia Hallgren,,United States,"May 24, 2019",TV-PG,38 min,Documentaries,"Displaced by Hurricane Maria, three Puerto Rican women navigate their families' uncertain futures as their federal housing aid in New York expires.",38.0
s329,Movie,After the Raid,Rodrigo Reyes,,"United States, Mexico","December 19, 2019",TV-PG,25 min,"Documentaries, International Movies",A large immigration raid in a small town leaves emotional fallout and hard questions for its churchgoers about what it means to love thy neighbor.,25.0
s343,Movie,Aggretsuko: We Wish You a Metal Christmas,Rarecho,"Kaolip, Shingo Kato, Komegumi Koiwasaki, Maki Tsuruta, Sohta Arai, Rina Inoue, Yuki Takahashi, Rarecho",Japan,"December 20, 2018",TV-PG,22 min,Movies,"While Retsuko desperately makes plans for Christmas Eve, her new obsession with seeking validation through social media spirals out of control.",22.0
s344,Movie,Agneepath,Mukul Anand,"Amitabh Bachchan, Mithun Chakraborty, Danny Denzongpa, Madhavi, Neelam, Alok Nath, Rohini Hattangadi, Tinnu Anand, Vikram Gokhale, Archana Puran Singh",India,"April 1, 2020",TV-14,174 min,"Dramas, International Movies","A boy grows up to become a gangster in pursuit of the mobster who killed his innocent father, but revenge and reparation may come at great costs.",174.0
s356,Movie,Aiyaary,Neeraj Pandey,"Sidharth Malhotra, Manoj Bajpayee, Rakul Preet Singh, Pooja Chopra, Adil Hussain, Kumud Mishra, Naseeruddin Shah, Anupam Kher, Vikram Gokhale, Juhi Babbar",India,"May 15, 2018",TV-MA,158 min,"Action & Adventure, Dramas, International Movies","When his protégé goes rogue and poses a grave threat to the government he serves, a veteran officer of the Indian Army tries to stop him at all costs.",158.0
s369,Movie,Ala Vaikunthapurramuloo,Trivikram Srinivas,"Allu Arjun, Pooja Hegde, Tabu, Sushanth, Nivetha Pethuraj, Jayaram, Murli Sharma",India,"February 27, 2020",TV-14,162 min,"Action & Adventure, Comedies, Dramas","After growing up enduring criticism from his father, a young man finds his world shaken upon learning he was switched at birth with a millionaire’s son.",162.0
s400,Movie,Alien Xmas,Stephen Chiodo,"Keythe Farley, Dee Bradley Baker, Kaliayh Rhambo, Michelle Deco, Barbara Goodson",United States,"November 20, 2020",TV-Y,42 min,Children & Family Movies,"A young elf mistakes a tiny alien for a Christmas gift, not knowing her new plaything has plans to destroy Earth's gravity — and steal all the presents.",42.0
s415,Movie,All In My Family,Hao Wu,,United States,"May 3, 2019",TV-14,40 min,"Documentaries, LGBTQ Movies","After starting a family of his very own in America, a gay filmmaker documents his loving, traditional Chinese family's process of acceptance.",40.0
s447,Movie,Amar Akbar Anthony,Manmohan Desai,"Vinod Khanna, Rishi Kapoor, Amitabh Bachchan, Neetu Singh, Parveen Babi, Shabana Azmi, Nirupa Roy, Pran",India,"December 31, 2019",TV-14,172 min,"Action & Adventure, Classic Movies, Comedies","Abandoned in a park by their father, Amar, Akbar and Anthony grow up independently and have no knowledge of one another. They're reunited as adults when, by coincidence, they all give blood at the same hospital.",172.0
s464,Movie,American Factory: A Conversation with the Obamas,,"President Barack Obama, Michelle Obama, Julia Reichert, Steven Bognar",United States,"September 5, 2019",TV-G,10 min,Documentaries,Barack and Michelle Obama talk with directors Steven Bognar and Julia Reichert about the documentary and the importance of storytelling.,10.0
s468,Movie,American Honey,Andrea Arnold,"Sasha Lane, Shia LaBeouf, Riley Keough, McCaul Lombardi, Arielle Holmes","United Kingdom, United States","April 27, 2019",R,163 min,"Dramas, Independent Movies","A teenage girl leaves her dull life in Oklahoma to join a raucous band of travelling magazine sellers on an alcohol-, drug- and sex-filled road trip.",163.0
s508,Movie,Andaz Apna Apna,Rajkumar Santoshi,"Aamir Khan, Salman Khan, Raveena Tandon, Karisma Kapoor, Paresh Rawal, Mehmood, Deven Verma, Jagdeep, Shakti Kapoor",India,"May 11, 2020",TV-14,160 min,"Action & Adventure, Comedies, Cult Movies","Broke and with no concrete plans for the future, two young men discover that a stunning heiress lives nearby and try to charm her into marriage.",160.0
s510,Movie,Andhaghaaram,V Vignarajan,"Vinoth Kishan, Arjun Das, Pooja Ramachandran, Kumar Natarajan, Misha Ghoshal, Arul Vincent, Chenthu Mohan, Pradeep Kalipurayath",,"November 24, 2020",TV-14,171 min,"Horror Movies, International Movies, Thrillers","As a blind librarian, dispirited cricketer and desolate psychiatrist each seek retribution and release, their lives overlap under eerie influences.",171.0
s511,Movie,Andhakaaram,V Vignarajan,"Vinoth Kishan, Arjun Das, Pooja Ramachandran, Kumar Natarajan, Misha Ghoshal, Arul Vincent, Chenthu Mohan, Pradeep Kalipurayath",India,"November 24, 2020",TV-14,171 min,"Horror Movies, International Movies, Thrillers","As a blind librarian, dispirited cricketer and desolate psychiatrist each seek retribution and release, their lives overlap under eerie influences.",171.0
s520,Movie,Angela's Christmas,Damien O’Connor,"Lucy O'Connell, Ruth Negga, Brendan Mullins, Malachy McCourt, Vivian Drew, Anya O'Connor, Janet Moran, Brian Gleeson, Pat Kinevane","Ireland, Canada","November 30, 2018",TV-Y,30 min,Children & Family Movies,A trip to church with her family on Christmas Eve gives young Angela an extraordinary idea. A heartwarming tale based on a story by Frank McCourt.,30.0
s526,Movie,Angu Vaikuntapurathu (Malayalam),Trivikram Srinivas,"Allu Arjun, Pooja Hegde, Tabu, Sushanth, Nivetha Pethuraj, Jayaram, Murli Sharma",,"March 5, 2020",TV-14,162 min,"Action & Adventure, Comedies, Dramas","After growing up enduring criticism from his father, a young man finds his world shaken upon learning he was switched at birth with a millionaire’s son.",162.0
s527,Movie,Ani... Dr. Kashinath Ghanekar,Abhijeet Deshpande,"Subodh Bhave, Vaidehi Parshurami, Nandita Patkar, Sonali Kulkarni, Sumeet Raghvan, Prasad Oak, Anand Ingale, Suhas Palshikar",India,"September 10, 2020",TV-14,157 min,"Dramas, International Movies","From his singular career to his personal demons, this biopic chronicles the short yet prolific life of the Marathi dentist-turned-superstar.",157.0
s528,Movie,ANIMA,Paul Thomas Anderson,Thom Yorke,United Kingdom,"June 27, 2019",TV-PG,15 min,"Dramas, Independent Movies, Music & Musicals","In a short musical film directed by Paul Thomas Anderson, Thom Yorke of Radiohead stars in a mind-bending visual piece. Best played loud.",15.0
s561,Movie,Apaharan,Prakash Jha,"Ajay Devgn, Nana Patekar, Bipasha Basu, Ayub Khan, Mohan Agashe, Mukesh Tiwari, Yashpal Sharma, Anoop Soni, Chetan Pandit",India,"January 8, 2021",TV-14,161 min,"Dramas, International Movies","Raised under the condescending eye of his activist father, an underachieving loafer is lured into the local kingpin’s web of corruption and kidnapping.",161.0
s600,Movie,Asoka,Santosh Sivan,"Shah Rukh Khan, Kareena Kapoor, Danny Denzongpa, Rahul Dev, Hrishitaa Bhatt, Gerson Da Cunha, Subhashini Ali, Umesh Mehra, Sooraj Balaji",India,"March 15, 2017",R,168 min,"Action & Adventure, Dramas, International Movies",This elaborate Bollywood epic dramatizes one man's transformation from a vengeful and cunning warrior into a legendary leader and teacher of Buddhism.,168.0
s623,Movie,Aurora,Cristi Puiu,"Cristi Puiu, Clara Voda, Catrinel Dumitrescu, Luminita Gheorghiu, Valentin Popescu, Gheorghe Ifrim, Ileana Puiu, Valeria Seciu, Gelu Colceag","Romania, France, Switzerland, Germany","March 4, 2020",TV-MA,186 min,"Dramas, International Movies","42-year-old Viorel, a distraught engineer, takes drastic measures to end his emotional suffering after enduring a devastating divorce.",186.0
s657,Movie,Baahubali 2: The Conclusion (Hindi Version),S.S. Rajamouli,"Prabhas, Rana Daggubati, Anushka Shetty, Tamannaah Bhatia, Sathyaraj, Ramya Krishnan, Nassar, Subbaraju",India,"August 7, 2017",TV-MA,165 min,"Action & Adventure, Dramas, International Movies","To avenge his father's death, a young man leads an army into battle against a cruel tyrant in this Hindi conclusion to the historic saga.",165.0
s658,Movie,Baahubali 2: The Conclusion (Malayalam Version),S.S. Rajamouli,"Prabhas, Rana Daggubati, Anushka Shetty, Tamannaah Bhatia, Sathyaraj, Ramya Krishnan, Nassar, Subbaraju",,"August 7, 2017",TV-14,166 min,"Action & Adventure, Dramas, International Movies","To avenge his father's death, a young man leads an army into battle against a cruel tyrant in this Malayalam conclusion to the historic saga.",166.0
s659,Movie,Baahubali 2: The Conclusion (Tamil Version),S.S. Rajamouli,"Prabhas, Rana Daggubati, Anushka Shetty, Tamannaah Bhatia, Sathyaraj, Ramya Krishnan, Nassar, Subbaraju",,"August 7, 2017",TV-MA,166 min,"Action & Adventure, Dramas, International Movies","To avenge his father's death, a young man leads an army into battle against a cruel tyrant in this Tamil conclusion to the historic saga.",166.0
s661,Movie,Baahubali: The Beginning (Hindi Version),S.S. Rajamouli,"Prabhas, Rana Daggubati, Anushka Shetty, Tamannaah Bhatia, Sathyaraj, Nassar, Ramya Krishnan, Sudeep",India,"August 7, 2017",TV-14,159 min,"Action & Adventure, Dramas, International Movies",Villagers in the kingdom of Mahismati rescue a baby who is destined to embark on a heroic quest in this Hindi version of S.S. Rajamouli's epic.,159.0
s662,Movie,Baahubali: The Beginning (Malayalam Version),S.S. Rajamouli,"Prabhas, Rana Daggubati, Anushka Shetty, Tamannaah Bhatia, Sathyaraj, Nassar, Ramya Krishnan, Sudeep",,"August 7, 2017",TV-14,160 min,"Action & Adventure, Dramas, International Movies",Villagers in the kingdom of Mahismati rescue a baby who is destined to embark on a heroic quest in this Malayalam version of S.S. Rajamouli's epic.,160.0
s663,Movie,Baahubali: The Beginning (Tamil Version),S.S. Rajamouli,"Prabhas, Rana Daggubati, Anushka Shetty, Tamannaah Bhatia, Sathyaraj, Nassar, Ramya Krishnan, Sudeep",,"August 7, 2017",TV-14,159 min,"Action & Adventure, Dramas, International Movies",Villagers in the kingdom of Mahismati rescue a baby who is destined to embark on a heroic quest in this Tamil version of S.S. Rajamouli's epic.,159.0
s757,Movie,Barsaat,Rajkumar Santoshi,"Twinkle Khanna, Bobby Deol, Danny Denzongpa, Raj Babbar, Ashwin Kaushal, Mukesh Khanna, Harish Patel",India,"April 1, 2018",TV-PG,166 min,"Action & Adventure, International Movies, Music & Musicals","A naïve young man and a rich city girl fall in love. Her stepfather, however, doesn't approve of the match and will stop at nothing to split the pair.",166.0
s772,Movie,Baxu and the Giants,Florian Schott,"Camilla Jo-Ann Daries, Wafeeq Narimab, Anna Louw, Steven Afrikaner, Ashwyn Mberi, Robert Hara Gaeb",Namibia,"September 30, 2020",TV-PG,29 min,"Dramas, International Movies",A young girl grows increasingly concerned about the rhino poaching in her village when it begins to directly impact her impoverished family.,29.0
s837,Movie,Benji's Very Own Christmas Story,Joe Camp,"Ron Moody, Patsy Garrett, Cynthia Smith",United States,"October 3, 2018",TV-G,25 min,Children & Family Movies,"While on a press tour, Benji goes behind the scenes of Santa's workshop. But Santa has a devastating secret, so it's up to Benji to save Christmas.",25.0
s920,Movie,Bill Hicks: One Night Stand,John Fortenberry,Bill Hicks,United Kingdom,"December 31, 2018",TV-MA,28 min,Stand-Up Comedy,"Bill Hicks remembers a wild night in 1989 and offers his views on puffing cigarettes, smoking weed, drinking, sex, commercials and music.",28.0
s921,Movie,Bill Hicks: Reflections,,"Bill Hicks, Steve Hicks",,"December 31, 2018",TV-MA,34 min,Documentaries,"This documentary about comedian Bill Hicks offers insight into his irreverent takes on, well, everything. Brother Steve Hicks is the star witness.",34.0
s936,Movie,Birders,Otilia Portillo Padua,,"United States, Mexico","September 25, 2019",TV-G,38 min,"Documentaries, International Movies",Bird watchers on both sides of the U.S.-Mexico border share their enthusiasm for protecting and preserving some of the world's most beautiful species.,38.0
s951,Movie,Black Friday,Anurag Kashyap,"Pavan Malhotra, Kay Kay Menon, Aditya Srivastava, Dibyendu Bhattacharya, Kishore Kadam, Gajraj Rao, Zakir Hussain, Imtiaz Ali, Pratima Kazmi, Raj Arjun",India,"November 19, 2020",TV-MA,162 min,"Dramas, International Movies",This docudrama based on the same-titled book tracks the aftermath of a 1993 bombing in Bombay through the eyes of a journalist covering the story.,162.0
s958,Movie,Black Mirror: Bandersnatch,,"Fionn Whitehead, Will Poulter, Craig Parkinson, Alice Lowe, Asim Chaudhry",United States,"December 28, 2018",TV-MA,312 min,"Dramas, International Movies, Sci-Fi & Fantasy","In 1984, a young programmer begins to question reality as he adapts a dark fantasy novel into a video game. A mind-bending tale with multiple endings.",312.0
s997,Movie,Blue Is the Warmest Color,Abdellatif Kechiche,"Léa Seydoux, Adèle Exarchopoulos, Salim Kechiouche, Aurélien Recoing, Catherine Salée, Benjamin Siksou, Mona Walravens, Alma Jodorowsky, Jérémie Laheurte, Anne Loiret, Benoît Pilot, Sandor Funtek, Fanny Maurin","France, Belgium, Spain","August 26, 2016",NC-17,180 min,"Dramas, Independent Movies, International Movies","Determined to fall in love, 15-year-old Adele is focused on boys. But it's a blue-haired girl she meets on the street who really piques her interest.",180.0
s1017,Movie,Bobby,Raj Kapoor,"Rishi Kapoor, Dimple Kapadia, Pran, Prem Nath, Sonia Sahni, Durga Khote, Aruna Irani, Prem Chopra, Farida Jalal",India,"December 31, 2019",TV-14,168 min,"Classic Movies, Dramas, International Movies","Raj, the son of strict, wealthy parents, falls in love with Bobby, the daughter of a poor Christian fisherman – a romance his parents oppose.",168.0
s1024,Movie,Bogda,Nisheeta Keni,"Suhas Joshi, Mrunmayee Deshpande, Rohit Kokate, Ajinkya Bhosale, Jayant Gadekar, Vivekanand Walake, Pallavi Malvade, Nirmala Tikam",India,"July 16, 2019",TV-PG,161 min,"Dramas, International Movies",An aspiring dancer accompanies her terminally ill mother on one last road trip that alternately strains and strengthens their knotty relationship.,161.0
s1027,Movie,BoJack Horseman Christmas Special: Sabrina's Christmas Wish,,"Will Arnett, Aaron Paul, Alison Brie, Adam Conover, Kristen Schaal, Fred Savage",United States,"December 19, 2014",TV-MA,26 min,Movies,"It's Christmas, and BoJack wants nothing to do with it. Then Todd shows up with a giant candy cane and an old ""Horsin' Around"" Christmas episode.",26.0
s1129,Movie,Buddy Thunderstruck: The Maybe Pile,Harry Chaskin,"Brian Atkinson, Ted Raimi, Harry Chaskin, Debi Derryberry, Philip Maurice Hayes, Leigh Kelly, J.D. Ryznar, Nick Shakoour, Ryan Wiesbrock, Clark Wiesbrock",United States,"July 14, 2017",TV-Y7,14 min,Movies,"Champion truck-racing dog Buddy and his best friend, ferret mechanic Darnell, paw through the ""maybe pile"" and test out a bunch of crazy stunts.",14.0
s1157,Movie,Bye Bye London,Almunsif Alsuwaisi,"Abdulhussain Abdulredah, Ghanem Al-Saleh, Mariam Al-Ghadban, Dawood Hussain, Entesar Alsharah, Mohamed Gaber",Kuwait,"May 21, 2020",TV-14,177 min,"Comedies, Dramas, International Movies","In this satirical play, a wealthy Kuwaiti businessman travels to London for pleasure and encounters a host of eccentric characters.",177.0
s1176,Movie,Calico Critters: A Town of Dreams,Momoko Kamiya,,,"November 1, 2018",TV-Y,11 min,Children & Family Movies,Freya heads into town with her mother for a very special occasion: a dress designed by her sister Stella is going to be in a fashion show!,11.0
s1177,Movie,Calico Critters: Everyone's Big Dream Flying in the Sky,Momoko Kamiya,Erika Harlacher,,"March 1, 2020",TV-Y,11 min,Children & Family Movies,"In the Hazelnut Chipmunk Family, Dominic is a little boy who loves to play, but a big moment will make him more grown-up on one memorable day.",11.0
s1178,Movie,Calico Critters: The Treasure of Calico Village,Momoko Kamiya,,,"November 1, 2018",TV-Y,22 min,Children & Family Movies,Freya and her friends inspire the mayor to put on a competition at the fete to pick the loveliest thing in Sylvanian Village.,22.0
s1204,Movie,Canvas,Frank E. Abney III,,United States,"December 11, 2020",G,9 min,"Children & Family Movies, Dramas","After a heartbreaking loss, a grandfather struggling to reclaim his passion for painting finds the inspiration to create again.",9.0
s1266,Movie,Chalte Chalte,Aziz Mirza,"Shah Rukh Khan, Rani Mukerji, Jas Arora, Satish Shah, Rajiv Verma, Lillete Dubey, Jayshree T., Johny Lever",India,"July 1, 2018",TV-14,166 min,"Dramas, International Movies, Romantic Movies","Priya and Raj are polar opposites. Raj is brash and earthy, while Pirya is sophisticated and something of a perfectionist in all she does. They really are like oil and water, but nonetheless, they dare to fall in love.",166.0
s1268,Movie,Chamatkar,Rajiv Mehra,"Shah Rukh Khan, Naseeruddin Shah, Urmila Matondkar, Malvika Tiwari, Shammi Kapoor, Deven Verma, Tinnu Anand, Anjana Mumtaz, Anjan Srivastav, Rakesh Bedi",India,"May 15, 2017",TV-14,164 min,"Comedies, International Movies, Sci-Fi & Fantasy","A village schoolteacher and the ghost of a murdered man, who were both betrayed by those closest to them, join forces to help each other.",164.0
s1328,Movie,Chico Bon Bon and the Very Berry Holiday,Darragh O'Connell,"Robbie Daymond, Dayci Brookshire, Anthony Tedesco, Andy Abbott, Emma Sloan Jacobs, Joanna Lewis, Matt Mercer, Ian Nikus",,"December 3, 2020",TV-Y,25 min,Children & Family Movies,"The Fix-It Force makes a plan to hit every home as fast as they can, delivering Blunderberry Cakes before the town awakes to avoid a holiday disaster.",25.0
s1382,Movie,ChuChuTV Surprise Eggs Learning Videos (Hindi),,,,"October 18, 2019",TV-Y,34 min,Children & Family Movies,Magic elephant Mr. Harlo uses playtime to help the children discover various surprises hidden inside colorful eggs.,34.0
s1384,Movie,Chup Chup Ke,"Priyadarshan, Kookie V. Gulati","Shahid Kapoor, Kareena Kapoor, Om Puri, Neha Dhupia, Sunil Shetty, Paresh Rawal, Rajpal Yadav, Shakti Kapoor",India,"November 1, 2018",TV-PG,158 min,"Comedies, Dramas, International Movies","Mistaking a broke, small-time hustler for a millionaire, two bumbling fishermen hatch a scheme to use him to help pay off their debts.",158.0
s1425,Movie,Cloud Atlas,"Lilly Wachowski, Lana Wachowski, Tom Tykwer","Tom Hanks, Halle Berry, Jim Broadbent, Hugo Weaving, Jim Sturgess, Doona Bae, Ben Whishaw, Keith David, James D'Arcy, Zhou Xun","Germany, United States, Hong Kong, Singapore","August 1, 2017",R,172 min,"Action & Adventure, Cult Movies, Dramas","In this star-studded drama, six seemingly disparate stories explore the complicated links that humanity shares through the generations.",172.0
s1502,Movie,Cops and Robbers,"Arnon Manor, Timothy Ware-Hill",Timothy Ware-Hill,United States,"December 28, 2020",PG-13,8 min,Dramas,Animation and activism unite in this multimedia spoken-word response to police brutality and racial injustice.,8.0
s1505,Movie,Cosmos Laundromat: First Cycle,Mathieu Auvray,"Pierre Bokma, Reinout Scholten van Aschat",Netherlands,"June 4, 2019",TV-MA,12 min,"Dramas, International Movies, Sci-Fi & Fantasy","Despondent on a desolate island, a suicidal sheep is thrown a lifeline by a quirky salesman, who offers him the gift of a lifetime.",12.0
