    Show_Id,Category,Title,Director,Cast,Country,Release_Date,Rating,Duration,Type,Description,Duration_Minutes
s1529,Movie,Creating The Queen's Gambit,,,,"January 8, 2021",TV-14,14 min,Documentaries,"A fascinating character. Exquisite sets. A wig for every era. The stars, creators and crew reveal how the hit series about a chess prodigy came to life.",14.0
s1545,Movie,Cristina,Michèle Ohayon,,United States,"July 4, 2019",TV-14,40 min,Documentaries,"In this short documentary, 37-year-old Cristina valiantly battles cancer while doing all she can to encourage others to live in the moment.",40.0
s1596,Movie,Dangal,Nitesh Tiwari,"Aamir Khan, Sakshi Tanwar, Fatima Sana Shaikh, Sanya Malhotra, Aparshakti Khurana, Zaira Wasim, Suhani Bhatnagar, Ritwik Sahore",India,"June 21, 2017",TV-PG,161 min,"Dramas, International Movies, Sports Movies",A once-promising wrestler pursues the gold medal he never won by training two of his daughters to compete at the Commonwealth Games.,161.0
s1663,Movie,Dear Dracula,Chad Van De Keere,"Nathan Gamble, Ray Liotta, Emilio Estevez, Ariel Winter, Matthew Lillard, Yuri Lowenthal, Marion Ross, Tara Strong",United States,"February 18, 2016",TV-Y7-FV,43 min,"Children & Family Movies, Comedies","When he gets a fan letter from a young monster movie buff, Dracula visits him and soon has a new friend helping him to get his confidence back.",43.0
s1734,Movie,Dhan Dhana Dhan Goal,Vivek Agnihotri,"John Abraham, Bipasha Basu, Arshad Warsi, Shernaz Patel, Boman Irani, Dibyendu Bhattacharya, Gilbert Montoya, Dalip Tahil, Rajendranath Zutshi","United Kingdom, India","November 1, 2018",TV-14,157 min,"Dramas, Music & Musicals, Sports Movies","In a last-ditch effort, the jaded coach of the Southall United Football Club assembles a ragtag team and helps lead the team to a comeback season.",157.0
s1755,Movie,Digs & Discoveries: All Track's Lead to Rome,Joey So,"Joseph May, Anna Francolini, Antonio Magro, Montserrat Lombard, Flaminia Cinque, Keith Wickham",,"March 15, 2020",TV-Y,23 min,Children & Family Movies,"After being introduced to Italy's ancient history, Thomas sets out to prove his expertise until his curiosity lands him in trouble in an old mine.",23.0
s1756,Movie,Digs & Discoveries: Mines of Mystery,Joey So,"Joseph May, Flaminia Cinque, Anna Francolini, Teresa Gallagher, Montserrat Lombard, Antonio Magro, Vincenzo Nicoli",,"March 15, 2020",TV-Y,23 min,Children & Family Movies,"Amidst Italy's ancient sites and hidden treasures, Thomas is inspired to make his own special discovery, sending him on a journey to find a lost legend.",23.0
s1757,Movie,Dil,Indra Kumar,"Aamir Khan, Madhuri Dixit, Saeed Jaffrey, Deven Verma, Anupam Kher, Shammi, Padma Rani, Rajesh Puri, Satyendra Kapoor",India,"October 12, 2020",TV-14,165 min,"Comedies, Dramas, International Movies",A miser’s scheme to set his son up with a millionaire’s daughter backfires when the two actually fall in love — just as his sly charade is revealed.,165.0
s1758,Movie,Dil Chahta Hai,Farhan Akhtar,"Aamir Khan, Saif Ali Khan, Akshaye Khanna, Preity Zinta, Sonali Kulkarni, Dimple Kapadia, Ayub Khan, Rajat Kapoor, Suhasini Mulay, Ahmed Khan",India,"December 15, 2019",TV-14,185 min,"Comedies, Dramas, International Movies","Inseparable childhood friends Akash, Sameer and Siddharth are just out of college. Nothing comes between them – until they each fall in love.",185.0
s1759,Movie,Dil Dhadakne Do,Zoya Akhtar,"Anil Kapoor, Priyanka Chopra, Ranveer Singh, Anushka Sharma, Farhan Akhtar, Shefali Shah, Rahul Bose, Parmeet Sethi, Vikrant Massey, Zarina Wahab, Aamir Khan",India,"December 15, 2019",TV-MA,174 min,"Comedies, Dramas, International Movies","While hosting a shipboard holiday for relatives and friends, a wealthy but dysfunctional family must face the ugly truths under their flawless facade.",174.0
s1760,Movie,Dil Hai Tumhaara,Kundan Shah,"Rekha, Preity Zinta, Mahima Chaudhry, Arjun Rampal, Jimmy Shergill, Alok Nath, Dilip Joshi, Govind Namdeo",India,"April 1, 2018",TV-14,176 min,"Dramas, International Movies, Music & Musicals","The sophisticated son of a powerful businessman falls for a simple, free-spirited girl whose older sister is in love with him.",176.0
s1761,Movie,Dil Se,Mani Ratnam,"Shah Rukh Khan, Manisha Koirala, Preity Zinta, Raghuvir Yadav, Zohra Sehgal, Sabyasachi Chakraborty, Piyush Mishra, Krishnakant, Aditya Srivastava",India,"March 1, 2018",TV-14,166 min,"Dramas, International Movies, Romantic Movies",A radio broadcaster's intense attraction to a mysterious woman opens the door to a tidal wave of powerful emotions and desires.,166.0
s1788,Movie,Django Unchained,Quentin Tarantino,"Jamie Foxx, Christoph Waltz, Leonardo DiCaprio, Kerry Washington, Samuel L. Jackson, Walton Goggins, Dennis Christopher, James Remar, David Steen, Dana Gourrier, Nichole Galicia, Laura Cayouette, Ato Essandoh, Sammi Rotibi, Escalante Lundy, Don Johnson",United States,"April 25, 2020",R,165 min,"Action & Adventure, Dramas","Accompanied by a German bounty hunter, a freed slave named Django travels across America to free his wife from a sadistic plantation owner.",165.0
s1794,Movie,Doctor Zhivago,David Lean,"Omar Sharif, Julie Christie, Geraldine Chaplin, Rod Steiger, Alec Guinness, Tom Courtenay, Siobhan McKenna, Ralph Richardson, Jeffrey Rockland","United States, Italy, United Kingdom, Liechtenstein","November 1, 2019",PG-13,200 min,"Classic Movies, Dramas, Romantic Movies",A young physician and his beautiful mistress get swept up in the danger and drama of the Bolshevik Revolution in this Oscar-winning epic.,200.0
s1808,Movie,Don,Farhan Akhtar,"Shah Rukh Khan, Priyanka Chopra, Arjun Rampal, Isha Koppikar, Kareena Kapoor, Boman Irani, Om Puri, Pavan Malhotra",India,"December 15, 2019",TV-14,169 min,"Action & Adventure, International Movies","A ruthless crime boss and drug lord is nabbed and held captive by the authorities, who send his naïve look-alike to infiltrate the man's gang.",169.0
s1856,Movie,Dragons: Dawn of the Dragon Racers,"Elaine Bogan, John Sanford","Jay Baruchel, America Ferrera, Zack Pearlman, Christopher Mintz-Plasse, T.J. Miller, Andree Vermeulen",United States,"December 16, 2018",TV-PG,27 min,"Children & Family Movies, Comedies","The ""How to Train Your Dragon"" adventure continues when a hunt for lost sheep turns into a fierce, fun-filled competition.",27.0
s1863,Movie,Dream Big: Engineering Our World,Greg MacGillivray,Jeff Bridges,United States,"July 1, 2018",TV-G,42 min,Documentaries,"Narrated by Jeff Bridges, this compelling documentary examines some incredible achievements of engineering from across the globe.",42.0
s1878,Movie,Drishyam,Nishikant Kamat,"Ajay Devgn, Shriya Saran, Tabu, Rajat Kapoor, Ishita Dutta, Mrunal Jadhav, Prasanna Ketkar, Yogesh Sonam, Prathamesh Parab, Rishabh Chaddha",India,"July 5, 2020",TV-14,162 min,"Dramas, International Movies, Thrillers",An unexceptional man becomes a murder suspect when the son of a high-ranking police official who harassed his daughter goes missing.,162.0
s1893,Movie,Dum,Eeshwar Nivas,"Vivek Oberoi, Diya Mirza, Atul Kulkarni, Govind Namdeo, Mukesh Rishi, Sushant Singh, Yashpal Sharma, Sheeba",India,"March 1, 2018",TV-14,162 min,"Action & Adventure, Dramas, International Movies","When one of his colleagues becomes corrupted by power and goes over to the dark side, a young police officer tries to bring the offender to justice.",162.0
s1896,Movie,Duniya,Ramesh Talwar,"Dilip Kumar, Rishi Kapoor, Pran, Amrita Singh, Ashok Kumar, Prem Chopra, Amrish Puri, Satyen Kappu, Mac Mohan, Javed Khan",India,"April 1, 2020",TV-14,170 min,"Action & Adventure, Dramas, International Movies","A lawyer defends his childhood friend – and girlfriend's brother – in a murder case, unaware of his own deep connection to the attorney he’s up against.",170.0
s1897,Movie,Duplicate,Mahesh Bhatt,"Shah Rukh Khan, Juhi Chawla, Sonali Bendre, Farida Jalal, Mohnish Bahl, Tiku Talsania, Gulshan Grover, Sharat Saxena",India,"April 1, 2020",TV-14,165 min,"Comedies, Dramas, International Movies","Hilarious mix-ups and deadly encounters ensue when a convict seeks to escape authorities by assuming the identity of his doppelgänger, a perky chef.",165.0
s1973,Movie,Elephants Dream 4 Hour,Bassam Kurdali,"Cas Jansen, Tygo Gernandt",Netherlands,"August 23, 2018",TV-MA,196 min,"International Movies, Sci-Fi & Fantasy","Friends Proog and Emo live in a capricious, seemingly infinite machine with a sinister purpose in this experimental computer-animated short.",196.0
s1975,Movie,Elf Pets: A Fox Cub’s Christmas Tale,Chanda Bell,"Leslie Bellair, Brad Hyland, Brody Rose, Carol Aebersold",United States,"November 1, 2020",TV-Y,28 min,Children & Family Movies,An elite team of elves – and their furry fox cub friends – help bring the Christmas spirit to a boy whose mom may not make it home for the holidays.,28.0
s1976,Movie,Elf Pets: Santa’s Reindeer Rescue,Chanda Bell,"Brad Hyland, Drew Barber, Ashley Roberts, Lowrey Brown, Kristyl Tift, Manny Mahen, Olivia Berkeley, Eleanor Rocha",United States,"November 1, 2020",TV-Y,27 min,Children & Family Movies,"Determined to help Santa get ready for his merry rounds of gift-giving, a team of special elves wrangles in more reindeer and much-needed holiday magic.",27.0
s2002,Movie,End Game,"Rob Epstein, Jeffrey Friedman",,United States,"May 4, 2018",TV-PG,40 min,Documentaries,"Facing an inevitable outcome, terminally ill patients meet extraordinary medical practitioners seeking to change our approach to life and death.",40.0
s2007,Movie,English Babu Desi Mem,Praveen Nischol,"Shah Rukh Khan, Sonali Bendre, Rajeshwari, Saeed Jaffrey, Kiran Kumar, Baba Brahmbhatt, Ishita Haria, Sunny Singh, Gulshan Bawra",India,"May 1, 2017",TV-14,163 min,"Comedies, Dramas, International Movies","After his brother dies, wealthy Vikram reluctantly returns to India and forms a surprise bond with his orphaned nephew and the showgirl raising him.",163.0
s2077,Movie,Extremis,Dan Krauss,,United States,"September 13, 2016",TV-PG,25 min,Documentaries,"Witness the wrenching emotions that accompany end-of-life decisions as doctors, patients and families in a hospital ICU face harrowing choices.",25.0
s2108,Movie,Famous in Ahmedabad,Hardik Mehta,,India,"December 15, 2016",TV-14,29 min,"Documentaries, International Movies",Follow an 11-year-old boy as he goes from ordinary child to colorful competitor in his quest for a big win at India’s biggest kite-flying festival.,29.0
s2111,Movie,Fanatyk,Michał Tylka,"Piotr Cyrwus, Mikołaj Kubacki, Anna Radwan, Marian Dziędziel, Jan Nowicki, Juliusz Chrząstowski, Małgorzata Krzysica, Jacek Strama",Poland,"February 14, 2020",TV-MA,33 min,"Comedies, Dramas, Independent Movies","As a son deals with his own struggles, he must calm his father's obsession with fishing before his outlandish behavior ruins the entire family.",33.0
s2120,Movie,Fashion,Madhur Bhandarkar,"Priyanka Chopra, Kangana Ranaut, Mugdha Godse, Arbaaz Khan, Arjan Bajwa, Raj Babbar, Kiran Juneja, Samir Soni",India,"August 2, 2018",TV-MA,158 min,"Dramas, International Movies",A small-town girl finally realizes her dream of becoming a famous supermodel but soon finds there's a price for her glamorous new life.,158.0
s2153,Movie,Fiddler on the Roof,Norman Jewison,"Topol, Norma Crane, Leonard Frey, Molly Picon, Paul Mann, Rosalind Harris, Michele Marsh, Neva Small, Paul Michael Glaser, Ray Lovelock",United States,"July 1, 2020",G,181 min,"Classic Movies, Dramas, Music & Musicals","This adaptation of the musical chronicles the trials of a Jewish peasant, his wife, and their three strong-willed daughters in pre-revolutionary Russia.",181.0
s2156,Movie,Fifty Year Old Teenager,Fouad Al Shatti,"Abdulhussain Abdulredah, Haifaa Adel, Dawood Hussain, Mohamed Gaber",,"May 21, 2020",TV-14,204 min,"Comedies, International Movies",The life of a married 50-year-old doctor turns topsy-turvy when he falls in love with a younger woman and begins to act like a teenager.,204.0
s2158,Movie,Figaro Pho,Luke Jurevicius,Luke Jurevicius,United Kingdom,"September 1, 2016",TV-Y7,29 min,"Children & Family Movies, Comedies",Quirky little Figaro has a whole alphabet's worth of phobias. These wordless animated shorts follow his many fears from A to Z.,29.0
s2173,Movie,Fire in Paradise,"Drea Cooper, Zackary Canepari",,United States,"November 1, 2019",TV-MA,40 min,Documentaries,"In this documentary, survivors recall the catastrophic 2018 Camp Fire, which razed the town of Paradise and became California’s deadliest wildfire.",40.0
s2201,Movie,Fiza,Khalid Mohamed,"Karisma Kapoor, Jaya Bhaduri, Hrithik Roshan, Neha, Asha Sachdev, Bikram Saluja, Isha Koppikar, Johny Lever, Sushmita Sen, Manoj Bajpayee",India,"August 2, 2018",TV-14,163 min,"Dramas, International Movies, Music & Musicals","Fiza's brother disappears during Mumbai's horrifying 1993 riots. Each day, Fiza and her widowed mother hope that he will return.",163.0
s2263,Movie,"Frankenstein’s Monster’s Monster, Frankenstein",Daniel Gray Longino,"David Harbour, Alex Ozerov, Kate Berlant, Mary Woronov, Alfred Molina, Heather Lawless, Michael Lerner, Marion Van Cuyck, Bridey Elliott, O-Lan Jones, Lidia Porto, Graham Wagner, Randolph Thompson",United States,"July 16, 2019",TV-14,32 min,Comedies,"When actor David Harbour finds lost footage of his father's disastrous televised stage play of a literary classic, he uncovers shocking family secrets.",32.0
s2291,Movie,Friendship,Raj Khosla,"Amitabh Bachchan, Shatrughan Sinha, Zeenat Aman, Prem Chopra, Amrish Puri, Helen, Pran, Gajanan Jagirdar, Sajjan, Iftekhar",India,"April 1, 2020",TV-14,161 min,"Action & Adventure, Dramas, International Movies","Best friends since childhood, a righteous cop and a lawyer who represents criminals in court become rivals when they fall for the same woman.",161.0
s2295,Movie,From One Second to the Next,Werner Herzog,,United States,"April 15, 2014",TV-14,35 min,Documentaries,Werner Herzog chronicles the devastating consequences of texting and driving. The film examines how lives can be forever altered by a trivial text.,35.0
s2352,Movie,Gangs of New York,Martin Scorsese,"Leonardo DiCaprio, Daniel Day-Lewis, Cameron Diaz, Jim Broadbent, John C. Reilly, Henry Thomas, Liam Neeson, Brendan Gleeson, Gary Lewis, Stephen Graham","United States, Italy","August 20, 2019",R,167 min,Dramas,"In the crime-ridden slums of New York in the 1860s, vengeful orphan Amsterdam Vallon joins the cutthroat gang of his father's killer, Bill the Butcher.",167.0
s2394,Movie,Ghayal,Rajkumar Santoshi,"Sunny Deol, Meenakshi Sheshadri, Amrish Puri, Moushumi Chatterjee, Kulbhushan Kharbanda, Om Puri, Raj Babbar, Shabbir Khan",India,"December 31, 2019",TV-14,163 min,"Action & Adventure, Dramas, International Movies","Framed for his older brother's murder, a boxer seeks violent revenge against the true killer who's torn his family apart.",163.0
s2405,Movie,Ghosts of Sugar Land,Bassam Tariq,,United States,"October 16, 2019",TV-MA,22 min,Documentaries,"Shocked when their friend embraces extremism, a group of Muslim Americans in Texas recount their time with him and theories about his fate.",22.0
s2408,Movie,Ghulam-E-Musthafa,Partho Ghosh,"Nana Patekar, Raveena Tandon, Paresh Rawal, Aruna Irani, Mohan Joshi, Mohnish Bahl, Shivaji Satham, Vishwajeet Pradhan, Ashwin Kaushal, Satish Shah",India,"December 31, 2019",TV-MA,161 min,"Action & Adventure, Dramas, International Movies","Giving up his life of crime for love, a gangster struggles with a moral dilemma when tragic events and enduring enemies take him back to the underworld.",161.0
s2448,Movie,Go! Go! Cory Carson: The Chrissy,"Alex Woo, Stanley Moore","Alan C. Lim, Maisie Benson, Kerry Gudjohnsen, Terrance Smith, Paul Killam, Omari Weaver, Ella Joy Ballesteros, Smith Foreman, Stanley Moore",United States,"May 1, 2020",TV-Y,42 min,Children & Family Movies,"The Carson kids win a talent show with a dance that Cory created. But when ""The Chrissy"" catches on, his little sister gets all of the attention.",42.0
s2465,Movie,Golden Time,Takuya Inaba,,Japan,"November 1, 2017",TV-Y,22 min,"International Movies, Sci-Fi & Fantasy","In the 1980s, a recently discarded television set from the 1960s refuses to accept its fate and tries to break out of the junkyard.",22.0
s2589,Movie,Hamara Dil Aapke Paas Hai,Satish Kaushik,"Anil Kapoor, Aishwarya Rai Bachchan, Sonali Bendre, Puru Rajkumar, Anupam Kher, Satish Kaushik, Mukesh Rishi, Jaspal Bhatti, Razak Khan, Himani Shivpuri, Smita Jaykar, Tanaaz Currim Irani",India,"March 1, 2018",TV-14,158 min,"Dramas, International Movies, Music & Musicals","Love blooms when kind-hearted Avinash takes in Preeti, a woman shunned by society, but the unorthodox living situation creates quite a stir among the neighbors.",158.0
s2614,Movie,Happy New Year,Farah Khan,"Shah Rukh Khan, Deepika Padukone, Abhishek Bachchan, Sonu Sood, Boman Irani, Vivaan Shah",India,"February 1, 2017",TV-14,179 min,"Action & Adventure, Comedies, Dramas",A revenge-seeking diamond thief gathers a ragtag crew to infiltrate a Dubai hotel hosting a dance contest. But first they have to learn how to dance.,179.0
s2711,Movie,Heroin(e),Elaine McMillion Sheldon,,United States,"September 12, 2017",TV-14,40 min,Documentaries,"This documentary follows three women – a fire chief, a judge and a street missionary – as they battle West Virginia's devastating opioid epidemic.",40.0
s2763,Movie,Ho Mann Jahaan,Asim Raza,"Adeel Hussain, Mahira Khan, Sheheryar Munawar, Sonya Jehan, Bushra Ansari, Nimra Bucha, Arshad Mahmud, Jamal Shah",Pakistan,"July 1, 2017",TV-PG,170 min,"Dramas, International Movies, Romantic Movies","Three friends in modern-day Karachi navigate their post-college lives, while struggling to balance their passion for music with familial obligations.",170.0
s2860,Movie,Hum Aapke Hain Koun,Sooraj R. Barjatya,"Madhuri Dixit, Salman Khan, Mohnish Bahl, Renuka Shahane, Anupam Kher, Reema Lagoo, Alok Nath, Bindu",India,"February 1, 2020",TV-14,193 min,"Classic Movies, Dramas, International Movies","Although Nisha falls for Prem, she agrees to marry his older brother for the good of their families. But fate may have other plans for the lovebirds.",193.0
s2861,Movie,Hum Saath-Saath Hain,Sooraj R. Barjatya,"Salman Khan, Karisma Kapoor, Saif Ali Khan, Tabu, Sonali Bendre, Mohnish Bahl, Mahesh Thakur, Neelam, Alok Nath, Satish Shah",India,"January 1, 2018",TV-G,176 min,"Dramas, International Movies, Music & Musicals","A scheming matriarch plots to cut off her disabled stepson and his wife from the family fortune, creating a division within the clan.",176.0
s2940,Movie,If Anything Happens I Love You,"Will McCormack, Michael Govier",,United States,"November 20, 2020",PG,13 min,Dramas,Grieving parents journey through an emotional void as they mourn the loss of a child in the aftermath of a tragic school shooting.,13.0
s3092,Movie,Jaal,Umesh Mehra,"Jeetendra, Mithun Chakraborty, Rekha, Mandakini, Moon Moon Sen, Vinod Mehra, Tanuja, Amrit Pal",India,"December 8, 2017",TV-14,162 min,"Action & Adventure, International Movies","When a mysterious woman hires Shankar to spy on a family, he must determine how his own father's abandonment figures into the situation.",162.0
s3093,Movie,Jaan-E-Mann: Let's Fall in Love... Again,Shirish Kunder,"Salman Khan, Akshay Kumar, Preity Zinta, Anupam Kher, Aman Verma, Javed Sheikh, Soni Razdan, Nawab Shah",India,"December 31, 2019",TV-14,163 min,"Dramas, International Movies, Romantic Movies","To avoid alimony payments, an aspiring actor schemes for his ex-wife to marry an unlikely suitor, but soon realizes he may not be ready to lose her.",163.0
s3116,Movie,Jake's Buccaneer Blast,,"Megan Richie, Riley Thomas Stewart, Jadon Sand, David Arquette, Jeff Bennett, Corey Burton, Adam Wylie, Dee Bradley Baker",,"August 6, 2017",TV-Y,22 min,Movies,"Jake, Izzy, Cubby and Skully face off against the scheming Captain Hook in a race to find special treasures hidden all around Never Land.",22.0
s3188,Movie,Jis Desh Men Ganga Behti Hai,Radhu Karmakar,"Raj Kapoor, Padmini, Pran, Chanchal, Lalita Pawar, Raj Mehra, Tiwari, Nana Palsikar, Nayampally, Sulochana Chatterjee",,"December 31, 2019",TV-14,181 min,"Action & Adventure, Dramas, International Movies","Falling in with a band of outlaws during a holy pilgrimage, a country boy tries to change their violent ways ahead of a showdown with the authorities.",181.0
s3196,Movie,Jodhaa Akbar,Ashutosh Gowariker,"Hrithik Roshan, Aishwarya Rai Bachchan, Sonu Sood, Poonam Sinha, Suhasini Mulay, Ila Arun, Raza Murad, Kulbhushan Kharbanda, Abeer Abrar",India,"October 1, 2018",TV-14,214 min,"Action & Adventure, Dramas, International Movies","In 16th-century India, what begins as a strategic alliance between a Mughal emperor and a Hindu princess becomes a genuine opportunity for true love.",214.0
s3212,Movie,John Was Trying to Contact Aliens,,,United States,"August 20, 2020",TV-PG,17 min,"Documentaries, LGBTQ Movies","A rural electronics whiz broadcasts radio signals into space and monitors for signs of aliens, but makes a more important connection here on Earth.",17.0
s3277,Movie,Kaalia,Tinnu Anand,"Amitabh Bachchan, Asha Parekh, Parveen Babi, Amjad Khan, Pran, K.N. Singh, Sajjan, Murad, Kader Khan, Jagdeep",India,"December 31, 2019",TV-14,173 min,"Action & Adventure, Dramas, International Movies","Jailed for robbing his brother’s unscrupulous employer, a simpleton has a transformation while in prison, emerging with a violent mission for revenge.",173.0
s3281,Movie,Kabhi Alvida Naa Kehna,Karan Johar,"Amitabh Bachchan, Shah Rukh Khan, Abhishek Bachchan, Rani Mukerji, Preity Zinta, Kiron Kher, Arjun Rampal",India,"April 1, 2020",TV-14,192 min,"Dramas, International Movies, Romantic Movies","Unhappy in their respective marriages, an ex-footballer and a teacher find true love in each other, but guilt, jealousy and tragedy cloud their affair.",192.0
s3283,Movie,Kabhi Khushi Kabhie Gham,Karan Johar,"Amitabh Bachchan, Jaya Bhaduri, Shah Rukh Khan, Kajol, Hrithik Roshan, Kareena Kapoor, Rani Mukerji, Farida Jalal, Himani Shivpuri, Alok Nath",India,"April 1, 2020",TV-14,209 min,"Dramas, International Movies","Years after his father disowns his adopted brother for marrying a woman of lower social standing, a young man goes on a mission to reunite his family.",209.0
s3284,Movie,Kabir Singh,Sandeep Reddy Vanga,"Shahid Kapoor, Kiara Advani, Suresh Oberoi, Arjan Bajwa, Adil Hussain, Nikita Dutta, Kamini Kaushal, Anurag Arora",India,"September 19, 2019",TV-MA,171 min,"Dramas, International Movies, Romantic Movies","An exalted but short-fused surgeon plunges into a spiral of drugs, alcohol and rage after his intense relationship with his girlfriend turbulently ends.",171.0
s3291,Movie,Kal Ho Naa Ho,Nikkhil Advani,"Shah Rukh Khan, Saif Ali Khan, Preity Zinta, Jaya Bhaduri, Sushma Seth, Reema Lagoo, Lillete Dubey, Delnaaz Paul",India,"April 1, 2020",TV-14,187 min,"Comedies, Dramas, International Movies",An uptight MBA student falls for the charismatic new neighbor who charms her troubled family – but he has a secret that forces him to push her away.,187.0
s3296,Movie,Kalki,Dhilip Kumar,"Kishore Kumar G., Yasmin Ponnappa, Mithraboomi Saravanan",India,"March 1, 2018",TV-14,41 min,"Dramas, Independent Movies, International Movies",A scientist trying to solve one of the universe's greatest puzzles begins a romance with a much younger colleague that's haunted by a dark secret.,41.0
s3302,Movie,Kannum Kannum Kollaiyadithaal,Desingh Periyasamy,"Dulquer Salmaan, Ritu Varma, Rakshan, Niranjani, Gautham Menon, Anish Kuruvilla",India,"March 29, 2020",TV-14,160 min,"Comedies, Dramas, International Movies","A carefree racing enthusiast’s womanizing ways end when he meets the girl of his dreams, but their newfound peace is disrupted by a dangerous killer.",160.0
s3351,Movie,Kevin James: Sweat the Small Stuff,Paul Miller,Kevin James,United States,"February 20, 2019",TV-PG,42 min,Stand-Up Comedy,The film and television star riffs on life's many royal pains in this hourlong special taped at New York City's Hudson Theatre in 2001.,42.0
s3354,Movie,Khalnayak,Subhash Ghai,"Sanjay Dutt, Madhuri Dixit, Jackie Shroff, Anupam Kher, Rakhee Gulzar, Pramod Moutho, Ramya Krishnan, Sushmita Mukherjee, Neena Gupta, A.K. Hangal",India,"March 1, 2018",TV-14,170 min,"Action & Adventure, Dramas, International Movies",A prison guard goes undercover as a dancer to try and recapture an escaped criminal and restore her police inspector boyfriend's reputation.,170.0
s3363,Movie,Khushi,"Surya S.J., Sunil Kumar Agrawal","Fardeen Khan, Kareena Kapoor, Amrish Puri, Navin Nischol, Beena, Anup Soni, Johnny Lever, Sharat Saxena, Amitabh Bachchan, Sakshi Shivanand",India,"March 1, 2018",TV-14,157 min,"Comedies, International Movies, Music & Musicals","While playing matchmaker to a pair of their friends, two young university students begin developing feelings for each other.",157.0
s3398,Movie,King of Boys,Kemi Adetiba,"Sola Sobowale, Adesua Etomi, Remilekun Safaru, iLLBLISS, Toni Tones, Paul Sambo, Jide Kosoko, Sharon Ooja",Nigeria,"September 21, 2019",TV-MA,182 min,"Dramas, International Movies","When a powerful businesswoman’s political ambitions are threatened by her underworld connections, the ensuing power struggle could cost her everything.",182.0
s3461,Movie,Kuch Kuch Hota Hai,Karan Johar,"Shah Rukh Khan, Kajol, Rani Mukerji, Farida Jalal, Reema Lagoo, Salman Khan, Archana Puran Singh, Himani Shivpuri, Johny Lever, Anupam Kher, Sana Saeed",India,"April 1, 2020",TV-14,185 min,"Comedies, Dramas, International Movies","Per her mother’s last wish, a girl sets out to reunite her father with the college best friend who loved him – only to discover the woman is engaged.",185.0
