    Show_Id,Category,Title,Director,Cast,Country,Release_Date,Rating,Duration,Type,Description,Duration_Minutes
s3467,Movie,Kung Fu Panda: Holiday,Tim Johnson,"Jack Black, Angelina Jolie, Dustin Hoffman, Jackie Chan, Seth Rogen, Lucy Liu, David Cross, James Hong, Dan Fogler",United States,"December 1, 2012",TV-PG,26 min,"Children & Family Movies, Comedies","As preparations for the Winter Feast build, Po is caught between his obligations as the Dragon Warrior and his family holiday traditions.",26.0
s3468,Movie,Kung Fu Panda: Secrets of the Scroll,Rodolphe Guenoden,"Jack Black, Dustin Hoffman, Seth Rogen, David Cross, Lucy Liu, Tara Macri, James Hong, Randall Duk Kim",United States,"March 25, 2016",TV-PG,23 min,"Children & Family Movies, Comedies","When a twist of fate brings five unlikely animals together, they find that combining their unique kung fu styles as a team makes the perfect weapon!",23.0
s3479,Movie,Kyaa Kool Hai Hum,Sangeeth Sivan,"Tusshar Kapoor, Riteish Deshmukh, Isha Koppikar, Neha Dhupia, Anupam Kher, Jay Sean",India,"May 15, 2019",TV-14,165 min,"Comedies, International Movies, Music & Musicals","Longtime friends Rahul and Karan head to Mumbai intent on making their dreams come true, but both men are suddenly saddled with bad luck.",165.0
s3483,Movie,Kyun! Ho Gaya Na,Samir Karnik,"Aishwarya Rai Bachchan, Vivek Oberoi, Amitabh Bachchan, Om Puri, Rati Agnihotri, Sunil Shetty, Tinnu Anand, Rahul Singh",India,"March 1, 2018",TV-PG,165 min,"International Movies, Romantic Movies","Cinematic lovebirds Aishwarya Rai and Vivek Oberoi star in this love story about a sweet young girl, Diya, brought up by her widowed father on a coffee plantation in the village of Coorg.",165.0
s3511,Movie,Ladies First,Uraaz Bahl,,India,"March 8, 2018",TV-G,40 min,"Documentaries, International Movies, Sports Movies","Born amid poverty and limited women's rights in the village of Ratu, India, Deepika Kumari rose to become the No.1 female archer in the world at 18.",40.0
s3522,Movie,Lagaan,Ashutosh Gowariker,"Aamir Khan, Gracy Singh, Rachel Shelley, Paul Blackthorne, Kulbhushan Kharbanda, Raghuvir Yadav, Yashpal Sharma, Rajendranath Zutshi, Rajesh Vivek, Aditya Lakhia",India,"January 10, 2021",PG,224 min,"Dramas, International Movies, Music & Musicals","In 1890s India, an arrogant British commander challenges the harshly taxed residents of Champaner to a high-stakes cricket match.",224.0
s3525,Movie,Lakshya,Farhan Akhtar,"Amitabh Bachchan, Hrithik Roshan, Preity Zinta, Om Puri, Sharad Kapoor, Rajendranath Zutshi, Sushant Singh, Prashant Chainani, Shakeel Khan, Ranvir Shorey",India,"December 15, 2019",TV-PG,185 min,"Action & Adventure, Dramas, International Movies","After dropping out of the army, a spoiled teenager reenlists and proves his mettle by becoming an officer just as war breaks out.",185.0
s3560,Movie,LeapFrog: Letter Factory,Roy Allen Smith,"Joey Camen, Marie Danielle, Mark Cacciatore, Dave Fennoy, Debi Derryberry",United States,"April 15, 2020",TV-Y,37 min,Children & Family Movies,"In this entertaining installment of the wildly popular early-learning series, Professor Quigley, Leap, Lily and Tad arrive at the magical Letter Factory, where jumbles of sounds are miraculously shaped into letters.",37.0
s3561,Movie,LeapFrog: Numberland,Ron Myrick,"Jeannie Elias, Kat Feller, Sandy Fox, Cindy Robinson, Richard Rosenblatt",United States,"April 15, 2020",TV-Y,33 min,Movies,"With transport support from their magic car, Axel, the LeapFrog pets make a new friend named Max, who helps them learn counting skills in Numberland.",33.0
s3562,Movie,LeapFrog: Phonics Farm,Ron Myrick,"Jeannie Elias, Kat Feller, Sandy Fox, Cindy Robinson, Richard Rosenblatt",United States,"April 15, 2020",TV-Y,35 min,Movies,Scout takes a magical trip to a farm where an alligator and other friendly critters teach him all about sounding out the letters of the alphabet.,35.0
s3563,Movie,"LeapFrog: Sing-along, Read-along",Ron Myrick,"Julie Maddalena, Cindy Robinson",,"April 15, 2020",TV-Y,32 min,Children & Family Movies,"Using rhythm and rhymes, a funky band and a colorful cast of characters help make reading, sounding out vowels and building words easy and fun!",32.0
s3580,Movie,Lego DC Comics: Batman Be-Leaguered,Rick Morales,"Dee Bradley Baker, Troy Baker, John DiMaggio, Grey DeLisle, Tom Kenny, Nolan North, Khary Payton, James Arnold Taylor",United States,"February 1, 2019",TV-Y7,22 min,Movies,"When Superman and the other Justice League superheroes start disappearing, it's up to Batman to unravel the caper and save the day.",22.0
s3588,Movie,LEGO Jurassic World: The Indominus Escape,Michael D. Black,"A.J. LoCascio, Sendhil Ramamurthy, Fred Tatasciore, Jake Johnson, Lauren Lapkus, Zachary Levi, BD Wong, David Gunning",United States,"October 4, 2016",TV-Y7,25 min,"Children & Family Movies, Comedies",The scientists of Jurassic World create a captivating and terrifying new creature that loves hot dogs. But what happens when the hot dogs run out?,25.0
s3589,Movie,LEGO Marvel Super Heroes: Avengers Reassembled!,Rob Silvestri,"Laura Bailey, Troy Baker, Eric Bauza, Ben Diskin, Grant George, JP Karliak, Jim Meskimen, Bumper Robinson, Roger Craig Smith, Fred Tatasciore, Travis Willingham, Mick Wingert",United States,"August 6, 2017",TV-Y7,22 min,Children & Family Movies,"When Ultron seizes control of Iron Man's armor, the Avengers race to save their friend and stop an evil plot to take over the world.",22.0
s3590,Movie,LEGO Marvel Super Heroes: Black Panther,Michael D. Black,"James Mathis III, Keston John, Yvette Nicole Brown, Daisy Lightfoot, Isaac C. Singleton Jr., Trevor Devall, Liam O'Brien, Mick Wingert, Fred Tatasciore, Laura Bailey",United States,"February 1, 2019",TV-Y7,22 min,Children & Family Movies,"When Thanos joins forces with villains Killmonger and Klaue to destroy Earth, Black Panther rushes to stop them from stealing Wakanda's vibranium.",22.0
s3591,Movie,LEGO Marvel Super Heroes: Guardians of the Galaxy,,,United States,"February 1, 2019",TV-Y,22 min,Children & Family Movies,"The Guardians are on a mission to deliver the Build Stone to the Avengers before the Ravagers, Thanos and his underlings steal it from them.",22.0
s3596,Movie,LEGO: Marvel Super Heroes: Maximum Overload,Greg Richardson,"Troy Baker, Drake Bell, Fred Tatasciore, Dee Bradley Baker, Steve Blum, Adrian Pasdar, Greg Cipes, Chi McBride, Barry Dennen, Robin Atkin Downes",United States,"January 6, 2017",TV-Y7,22 min,Children & Family Movies,Villainous Loki is amassing an army to conquer Earth! His antics are keeping Spider-Man and S.H.I.E.L.D. busy as they tackle a host of bad guys.,22.0
s3604,Movie,Les Misérables,Tom Hooper,"Hugh Jackman, Russell Crowe, Anne Hathaway, Amanda Seyfried, Sacha Baron Cohen, Helena Bonham Carter, Eddie Redmayne, Aaron Tveit, Samantha Barks, Daniel Huttlestone","United Kingdom, United States","August 16, 2020",PG-13,158 min,"Dramas, International Movies, Music & Musicals","The musical version of Victor Hugo's epic tale of love and sacrifice, first produced for the stage in 1985, now receives the big-screen treatment.",158.0
s3606,Movie,Lessons from a School Shooting: Notes from Dunblane,Kim A. Snyder,,United States,"September 28, 2018",TV-14,24 min,Documentaries,"Two priests – one from Dunblane, Scotland, the other from Newtown, Connecticut – bond over school tragedies that occurred 16 years apart.",24.0
s3630,Movie,Life Overtakes Me,"John Haptas, Kristine Samuelson",,"Sweden, United States","June 15, 2019",TV-PG,40 min,Documentaries,"In the grip of trauma, hundreds of refugee children in Sweden withdraw from life's uncertainties into a coma-like illness called Resignation Syndrome.",40.0
s3662,Movie,Little Lunch: The Halloween Horror Story,Tim Bartley,"Flynn Curry, Olivia Deeble, Madison Lu, Oisín O'Leary, Faith Seci, Joshua Sitch, Heidi Arena, Wayne Hope",Australia,"March 15, 2018",TV-Y7,23 min,"Children & Family Movies, Comedies","When the class puts on a Halloween play about a boy who leaves behind his friends for a scary new place, it hits too close to home for one student.",23.0
s3663,Movie,Little Lunch: The Nightmare Before Graduation,Robyn Butler,"Flynn Curry, Olivia Deeble, Madison Lu, Oisín O'Leary, Faith Seci, Joshua Sitch, Heidi Arena, Wayne Hope",Australia,"March 15, 2018",TV-Y7,25 min,"Children & Family Movies, Comedies",Mrs. Gonsha's students are excited about the end of primary school – until they discover that a classmate might not move on with them.,25.0
s3665,Movie,Little Miss Sumo,Matt Kay,Hiyori Kon,United Kingdom,"October 28, 2019",TV-G,20 min,"Documentaries, International Movies, Sports Movies","In an ancient sport traditionally reserved for men, 20-year-old female sumo prodigy Hiyori attempts to revolutionize Japan’s national pastime.",20.0
s3695,Movie,Lock Your Girls In,Fouad El-Mohandes,"Fouad El-Mohandes, Sanaa Younes, Sherihan, Ahmed Rateb, Ijlal Zaki, Zakariya Mowafi",,"May 21, 2020",TV-PG,233 min,"Comedies, International Movies, Romantic Movies",A widower believes he must marry off his three problematic daughters before he can pursue his real goal of marrying his secret love.,233.0
s3713,Movie,Long Shot,Jacob LaMendola,,United States,"September 29, 2017",TV-14,40 min,Documentaries,"When Juan Catalan is arrested for a murder he didn't commit, he builds his case for innocence around raw footage from a popular TV show. A documentary.",40.0
s3721,Movie,"Lorena, Light-Footed Woman",Juan Carlos Rulfo,Lorena Ramírez,Mexico,"November 20, 2019",TV-G,28 min,"Documentaries, International Movies, Sports Movies",Lorena Ramírez of Mexico's Rarámuri community lives a pastoral life – except when she straps on her sandals to compete as an ultramarathon runner.,28.0
s3768,Movie,Love Ni Bhavai,Saandeep Patel,"Malhar Thakar, Pratik Gandhi, Aarohi Patel, Maulik Jagdish Nayak, Diana Raval, Roopa Divatia, Aarti Patel",India,"May 1, 2018",TV-14,163 min,"Comedies, International Movies, Romantic Movies","Not romantically inclined, a popular radio personality finds herself caught between two diametrically opposed suitors.",163.0
s3832,Movie,Ma Rainey's Black Bottom: A Legacy Brought to Screen,,"Glynn Turman, Denzel Washington, George C. Wolfe, Branford Marsalis, Viola Davis, Imani Perry, Michael Potts, Coleman Domingo, Constanza Romero, August Wilson, Todd Black, Dusan Brown, Taylour Paige, Ann Roth, Chadwick Boseman",,"December 18, 2020",TV-PG,32 min,"Documentaries, Music & Musicals","Viola Davis, Denzel Washington, George C. Wolfe and more share the heart, soul and history that brought August Wilson’s timeless play to the screen.",32.0
s3861,Movie,Magnolia,Paul Thomas Anderson,"Jeremy Blackman, Tom Cruise, Melinda Dillon, April Grace, Luis Guzmán, Philip Baker Hall, Philip Seymour Hoffman, Ricky Jay, William H. Macy, Alfred Molina, Julianne Moore, Michael Murphy, John C. Reilly, Jason Robards, Melora Walters",United States,"January 1, 2020",R,189 min,"Dramas, Independent Movies","Through chance, human action, past history and divine intervention, an eclectic cast of characters weaves and warps through each other's lives.",189.0
s3873,Movie,Main Hoon Na,Farah Khan,"Shah Rukh Khan, Sunil Shetty, Sushmita Sen, Zayed Khan, Amrita Rao, Kiron Kher, Boman Irani, Bindu, Naseeruddin Shah, Kabir Bedi",India,"April 1, 2018",TV-14,171 min,"Action & Adventure, Comedies, Dramas",Major Ram Prasad Sharma yearns to see project Mission Milaap come to fruition and usher in an era of peace between two warring countries. But the evil Raghavan will do anything to stop the peace process.,171.0
s3876,Movie,Maine Pyar Kiya,Sooraj R. Barjatya,"Salman Khan, Bhagyashree, Alok Nath, Rajeev Verma, Reema Lagoo, Ajit Vachani, Harish Patel, Deep Dhillon, Pervin Dastur, Mohnish Bahl",India,"January 1, 2018",TV-PG,192 min,"Dramas, International Movies, Music & Musicals","When the son of a wealthy businessman and the daughter of a struggling engineer fall in love, the young man's parents question the girl's motives.",192.0
s3879,Movie,Making The Witcher,Nathan Wiley,"Henry Cavill, Anya Chalotra, Freya Allan, Eamon Farren, Mimi Ndiweni, Adam Levy, MyAnna Buring, Joey Batey, Lauren Schmidt Hissrich, Tomasz Bagiński, Andrew Laws, Sneha Koorse, Declan De Barra, Beau DeMayo, Simon Emanuel, Iván Pohárnok, Tim Aslam, Charlotte Brändström",United States,"August 26, 2020",TV-MA,33 min,Documentaries,"Journey into the extraordinary world of ""The Witcher"" — from casting the roles to Jaskier's catchy song — in this behind-the-scenes look at the series.",33.0
s3880,Movie,Making Unorthodox,Marlene Melchior,,Germany,"March 26, 2020",TV-G,21 min,"Documentaries, International Movies",A look at the making of one of the first series to authentically portray and explore issues in a Hasidic community as they pertain to women's lives.,21.0
s3913,Movie,Mann,Indra Kumar,"Aamir Khan, Manisha Koirala, Sharmila Tagore, Dipti Bhatnagar, Dalip Tahil, Anil Kapoor",India,"September 28, 2020",TV-14,173 min,"Dramas, International Movies, Romantic Movies","A smooth talker falls for a music teacher aboard a cruise, but a cruel twist of fate hinders their plans to meet again months later.",173.0
s3916,Movie,Manoranjan,Shammi Kapoor,"Sanjeev Kumar, Zeenat Aman, Shammi Kapoor, Dev Kumar, Madan Puri, Paintal, Asit Kumar Sen, Agha, Murad, Shefali",India,"September 1, 2017",TV-14,162 min,"Comedies, International Movies, Music & Musicals","After getting fired, a police officer connects with a prostitute he met on the job in a red-light district and sets out to keep her off the streets.",162.0
s3922,Movie,Manu,Phanindra Narsetti,"Raja Goutham, Chandini Chowdary, Bomma Sreedhar, John Kottoly, Srikanth Mullagiri, Ravi Teja",India,"August 1, 2019",TV-14,177 min,"Dramas, Independent Movies, International Movies","The relationship between a painter and his admirer unfolds as an abstract, twist-filled hide-and-seek game against the backdrop of murder and revenge.",177.0
s3937,Movie,Marco Polo: One Hundred Eyes,Alik Sakharov,"Tom Wu, Benedict Wong, Michelle Yeoh",United States,"December 26, 2015",TV-MA,29 min,Movies,A defiant warrior-monk arrives at Kublai Khan's court in chains and soon earns his tragic nickname in this 30-minute origin story.,29.0
s3941,Movie,Mariah Carey's Merriest Christmas,James Yukich,"Mariah Carey, Lacey Chabert, Kelsey Grammer, Billy Gardell, Fina Strazza, Kenneth Edmonds, Cameron Mathison, Brennan Elliott",United States,"December 9, 2016",TV-G,38 min,"Children & Family Movies, Music & Musicals","Pop music superstar Mariah Carey hosts this all-star holiday celebration with special guests and a celebrity reading of ""The Night Before Christmas.""",38.0
s3944,Movie,Mark Gatiss: A Study in Sherlock,Nathan Landeg,"Benedict Cumberbatch, Martin Freeman, Una Stubbs, Rupert Graves, Mark Gatiss, Steven Moffat",,"May 1, 2016",TV-14,29 min,Movies,"Mark Gatiss, who co-created “Sherlock” and plays Mycroft Holmes, discusses the show with Benedict Cumberbatch, Martin Freeman and others in the cast.",29.0
s4052,Movie,Mersal,Atlee Kumar,"Joseph Vijay, S.J. Surya, Kajal Aggarwal, Samantha Ruth Prabhu, Nithya Menon, Vadivelu, Sathyaraj",India,"August 21, 2018",TV-14,162 min,"Action & Adventure, Dramas, International Movies","A detective arrests a doctor for crimes targeting medical professionals but later finds the real culprit in a tale of revenge, corruption and magic.",162.0
s4070,Movie,Michael Lost and Found,Daniel Wilner,,"Canada, United States","June 1, 2017",TV-PG,19 min,"Documentaries, International Movies, LGBTQ Movies","Benjie Nycum travels to Wyoming to visit his ex-lover, Michael Glatze, a former gay activist who now lives with his wife and works as a church pastor.",19.0
s4083,Movie,Mighty Express: A Mighty Christmas,Clint Butler,"Jay Hatton, Zoe Hatz, Meesha Contreras, Dylan Schombing, Tyler Nathan, Leo Orgil, Michela Luci, Ian Ho, Evan Lefeuvre, Annick Obonsawin, Gracen Daly",Canada,"December 5, 2020",TV-Y,26 min,Children & Family Movies,The Mighty Express welcomes a new train and speeds into a snowstorm to deliver Santa’s presents and save Christmas for all the kids in Tracksville.,26.0
s4165,Movie,Mohenjo Daro,Ashutosh Gowariker,"Hrithik Roshan, Sonakshi Sinha, Pooja Hegde, Kabir Bedi, Arunoday Singh, Kishori Shahane, Narendra Jha, Nitish Bharadwaj",India,"August 2, 2018",TV-14,168 min,"Action & Adventure, Dramas, International Movies","A courageous villager moves to the ancient city of Mohenjo Daro, where he falls for the daughter of a priest and does battle with a tyrant.",168.0
s4197,Movie,Monster High: New Ghoul at School,"Audu Paden, Eric Radomski","Kate Higgins, Salli Saffioti, Debi Derryberry, Laura Bailey, Yuri Lowenthal, Audu Paden, Troy Baker, Erin Fitzgerald",United States,"October 1, 2017",TV-Y7,23 min,Children & Family Movies,"Insecure new student Frankie Stein struggles to fit in at Monster High, where ultra-cool ghoul Cleo De Nile and hunky monster Deuce rule the roost.",23.0
s4274,Movie,Mujhse Shaadi Karogi,David Dhawan,"Rajpal Yadav, Amrish Puri, Kader Khan, Shashi Kala, Priyanka Chopra, Salman Khan, Akshay Kumar, Satish Shah",India,"December 31, 2019",TV-PG,158 min,"Comedies, International Movies, Romantic Movies","Samir must overcome a hostile horoscope, a hot temper and a determined rival to win the heart of Rani, the love of his life.",158.0
s4275,Movie,Mujrim,Umesh Mehra,"Mithun Chakraborty, Madhuri Dixit, Suresh Oberoi, Shakti Kapoor, Pallavi Joshi, Gulshan Grover, Amrish Puri, Nutan, Jagdeep, Sharat Saxena",India,"September 1, 2017",TV-14,163 min,"Action & Adventure, Dramas, International Movies","Jailed as a teenager, Shankar has been unable to stay on the right side of the law ever since, despite his wife's pleas and his mother's rejection.",163.0
s4285,Movie,Muqaddar ka Faisla,Prakash Mehra,"Raaj Kumar, Rakhee Gulzar, Raj Babbar, Tina Munim, Pran, Ranjeet, Meenakshi Sheshadri, Akbar Khan",India,"April 1, 2020",TV-14,172 min,"Action & Adventure, Comedies, Dramas",God-fearing Pandit Krishna Kant loses everything and turns to a life of crime after his landlord tries to rape his wife and tears his family apart.,172.0
s4301,Movie,Mutiny on the Bounty,"Lewis Milestone, Carol Reed","Marlon Brando, Trevor Howard, Richard Harris, Hugh Griffith, Richard Haydn, Tarita",United States,"November 1, 2019",TV-PG,185 min,"Action & Adventure, Classic Movies, Dramas","Marlon Brando gives a nuanced performance as the aristocratic Lt. Fletcher Christian, an officer aboard the HMS Bounty who leads a mutiny against the ship's tyrannical Capt. Bligh.",185.0
s4396,Movie,Namak Halaal,Prakash Mehra,"Amitabh Bachchan, Shashi Kapoor, Parveen Babi, Smita Patil, Waheeda Rehman, Om Prakash, Ranjeet, Satyendra Kapoor",India,"December 31, 2019",TV-14,171 min,"Action & Adventure, Comedies, International Movies","While loyally defending his boss from mobsters trying to kill him, a naive, hotel bellboy discovers the family he never knew he had.",171.0
s4424,Movie,National Parks Adventure,Greg MacGillivray,Robert Redford,United States,"February 1, 2018",TV-G,42 min,Documentaries,"Narrated by Robert Redford, this documentary tours the awe-inspiring landscapes, historic sites and untamed wilderness of America's great parks.",42.0
s4426,Movie,Natsamrat - Asa Nat Hone Nahi,Mahesh Manjrekar,"Nana Patekar, Medha Manjrekar, Mrinmayee Deshpande, Sunil Barve, Vikram Gokhale, Neha Pendse",India,"June 1, 2018",TV-14,165 min,"Dramas, International Movies","A veteran Shakespearean actor steps off the stage and into the painful tragedy of old age, facing ungrateful family and his fleeting legacy.",165.0
s4485,Movie,No Direction Home: Bob Dylan,Martin Scorsese,"Bob Dylan, Joan Baez, Dave Van Ronk, Peter Yarrow, Allen Ginsberg, Pete Seeger, Maria Muldaur, Mavis Staples, Al Kooper, Tony Glover","United Kingdom, United States, Japan","April 25, 2020",TV-MA,208 min,"Documentaries, Music & Musicals","Featuring rare concert footage and interviews with legendary musicians, this documentary traces Bob Dylan's life story and extraordinary career.",208.0
s4486,Movie,No Entry,Anees Bazmee,"Anil Kapoor, Salman Khan, Fardeen Khan, Bipasha Basu, Lara Dutta, Esha Deol, Celina Jaitly, Boman Irani",India,"March 1, 2018",TV-PG,161 min,"Comedies, International Movies","After a prank goes sideways, three buddies find their relationships  – with women and each other – tested in unexpected ways.",161.0
s4491,Movie,No Longer kids,Samir Al Asfory,"Said Saleh, Hassan Moustafa, Ahmed Zaki, Younes Shalabi, Nadia Shukri, Karima Mokhtar",Egypt,"May 21, 2020",TV-14,237 min,"Comedies, Dramas, International Movies","Hoping to prevent their father from skipping town with his mistress, four rowdy siblings resort to absurd measures to stop him.",237.0
s4573,Movie,Oddbods: Party Monsters,,"Nadia Ramlee, Chio Su-Ping, Jeremy Linn, Marlon Dance-Hooi",,"October 19, 2018",TV-Y,23 min,Movies,"Dressed up as detective Sherlock Holmes, Slick must crack the case when a magician turns Jeff's spooky-costume party guests into their scary alter egos.",23.0
s4574,Movie,Oddbods: The Festive Menace,,"Nadia Ramlee, Chio Su-Ping, Jeremy Linn, Marlon Dance-Hooi",,"December 1, 2018",TV-Y,23 min,Movies,"In this ""Oddbods"" special, Bubbles's latest invention, the Naughty-or-Nice Machine, zaps Santa Claus, jeopardizing the whole Christmas holiday season.",23.0
s4594,Movie,Oh! Baby,B. V. Nandini Reddy,"Samantha Ruth Prabhu, Lakshmi, Rajendraprasad, Naga Shourya, Rao Ramesh, Teja Sajja, Pragathi, Jagapathi Babu, Aishwarya, Urvashi",India,"September 14, 2019",TV-14,157 min,"Comedies, International Movies, Music & Musicals",A surly septuagenarian gets another chance at her 20s after having her photo snapped at a studio that magically takes 50 years off her life.,157.0
s4609,Movie,Om Shanti Om,Farah Khan,"Shah Rukh Khan, Deepika Padukone, Shreyas Talpade, Arjun Rampal, Kirron Kher, Javed Sheikh",India,"April 1, 2018",TV-14,169 min,"Comedies, Dramas, International Movies","Reincarnated 30 years after being killed in a suspicious on-set fire, a small-time actor is determined to punish the person who ignited the blaze.",169.0
s4636,Movie,Once Upon a Time in the West,Sergio Leone,"Henry Fonda, Charles Bronson, Claudia Cardinale, Jason Robards, Gabriele Ferzetti, Paolo Stoppa, Woody Strode, Jack Elam, Keenan Wynn, Frank Wolff, Lionel Stander","Italy, United States","November 20, 2019",PG-13,166 min,"Action & Adventure, Classic Movies, International Movies","In this epic spaghetti Western, a flinty gunslinger is hired by a railroad tycoon to kill anyone standing in the way of his trans-American iron horse.",166.0
s4637,Movie,One 2 Ka 4,Shashilal K. Nair,"Shah Rukh Khan, Juhi Chawla, Jackie Shroff, Nirmal Pandey, Dilip Joshi, Sahila Chaddha, Suresh Chatwal, Bharat Dabholkar, Baby Gazala, Akash Khurana",India,"March 15, 2017",TV-14,160 min,"Action & Adventure, Comedies, Dramas","When his partner is killed, a young cop is forced to care for the man's four children, and solicits the help of a woman who moves in with them.",160.0
s4646,Movie,One Last Shot,Mike Clattenburg,"Robb Wells, John Paul Tremblay, John Dunsworth",Canada,"August 24, 2018",TV-MA,31 min,Comedies,"In this low-budget short film, two best buddies meet up for a night of booze-fueled fun before one of them moves to Vancouver.",31.0
s4703,Movie,"Out of Many, One","John Hoffman, Nanfu Wang",,United States,"December 12, 2018",TV-PG,35 min,Documentaries,"In this documentary short, a diverse group of men and women discuss their personal journeys as they prepare for the U.S. citizenship test.",35.0
s4749,Movie,Palm Trees in the Snow,Fernando González Molina,"Mario Casas, Adriana Ugarte, Macarena García, Alain Hernández, Laia Costa, Emilio Gutiérrez Caba, Berta Vázquez, Daniel Grao",Spain,"May 1, 2016",TV-MA,163 min,"Dramas, International Movies, Romantic Movies","Finding a tantalizing clue in an old letter, a young woman journeys to her family's tropical plantation to uncover generations of secrets.",163.0
s4755,Movie,Panipat - The Great Betrayal,Ashutosh Gowariker,"Sanjay Dutt, Arjun Kapoor, Kriti Sanon, Zeenat Aman, Mohnish Bahl, Padmini Kolhapure, Kunal Kapoor, Suhasini Mulay",India,"February 14, 2020",TV-14,171 min,"Dramas, International Movies, Romantic Movies","In 18th-century India, a Maratha commander leads his army in preparation for a fierce battle against Afghan invaders in this film based on real events.",171.0
s4774,Movie,Pardes,Subhash Ghai,"Shah Rukh Khan, Amrish Puri, Mahima Chaudhry, Apoorva Agnihotri, Alok Nath, Himani Shivpuri, Padmavati Rao, Madhuri Bhatia, Dina Pathak, Benu Kalsi, Anand Balraj, Ajay Nagrath, Deepak Qazir, Shashi Sharma, Smita Jaykar, Pavan Malhotra, Aditya Narayan, Subhash Ghai",India,"March 1, 2018",TV-14,187 min,"Dramas, International Movies, Romantic Movies","Prompted by loyalty, Arjun plays matchmaker between his philandering foster brother and a conservative girl but winds up falling in love himself.",187.0
s4784,Movie,Party Monster: Scratching the Surface,,"Ellie Kemper, Jane Krakowski, Tituss Burgess, Carol Kane, Jon Hamm, Bobby Moynihan, Lauren Adams, Sara Chase, Sol Miranda, Derek Klena, Aidy Bryant",United States,"August 17, 2018",TV-14,33 min,Comedies,"In the probing documentary ""Party Monster,"" DJ Fingablast investigates what became of his childhood hero, DJ Slizzard.",33.0
s4831,Movie,Period. End of Sentence.,Rayka Zehtabchi,,United States,"February 12, 2019",TV-PG,26 min,Documentaries,"In rural India, where the stigma of menstruation persists, women make low-cost sanitary pads on a new machine and stride toward financial independence.",26.0
s4839,Movie,Petta,Karthik Subbaraj,"Rajnikanth, Vijay Sethupathi, M. Sasikumar, Nawazuddin Siddiqui, Trisha Krishnan, Simran",India,"April 5, 2019",TV-14,170 min,"Action & Adventure, Comedies, Dramas","An affable, newly appointed college warden proves to be no ordinary man when an old enemy resurfaces and exposes his complicated, violent past.",170.0
