    Show_Id,Category,Title,Director,Cast,Country,Release_Date,Rating,Duration,Type,Description,Duration_Minutes
s4840,Movie,Petta (Telugu Version),Karthik Subbaraj,"Rajnikanth, Vijay Sethupathi, M. Sasikumar, Nawazuddin Siddiqui, Trisha Krishnan, Simran",,"April 7, 2019",TV-14,170 min,"Action & Adventure, Comedies, Dramas","An affable, newly appointed college warden proves to be no ordinary man when an old enemy resurfaces and exposes his complicated, violent past.",170.0
s4846,Movie,Phir Bhi Dil Hai Hindustani,Aziz Mirza,"Shah Rukh Khan, Juhi Chawla, Paresh Rawal, Satish Shah, Dilip Tahil, Govind Namdeo, Smita Jaykar, Shakti Kapoor, Johnny Lever",India,"April 1, 2018",TV-14,159 min,"Comedies, Dramas, International Movies","In this Bollywood entertainment, two journalists, Ajay and Ria, work for rival TV stations and compete heavily to mask their feelings for each other.",159.0
s4881,Movie,Players,"Abbas Alibhai Burmawalla, Mastan Alibhai Burmawalla","Vinod Khanna, Abhishek Bachchan, Bobby Deol, Sonam Kapoor, Bipasha Basu, Neil Nitin Mukesh, Sikander Kher, Omi Vaidya, Johny Lever, Shweta Bhardwaj",India,"July 5, 2020",TV-14,162 min,"Action & Adventure, International Movies","Learning of a fortune in gold being secretly shipped to Romania, master thieves Charlie and Riya assemble a crack team to steal it.",162.0
s4887,Movie,Poacher,Tom Whitworth,"Brian Ogola, Davina Leonard, Shiviske Shivisi, Lenny Juma, Olwenya Maina, Peter King, Alfred Munyua, Mwajuma Belle","United Kingdom, Kenya","September 30, 2020",TV-MA,28 min,"Dramas, International Movies, Thrillers",A daring farmer steals illicit ivory from a group of international terrorists and must elude their dangerous and deadly games.,28.0
s4889,Movie,Pocoyo & Cars,,"Stephen Fry, Alex Marty",,"May 1, 2018",TV-Y,19 min,Movies,"Pocoyo gears up for exciting car races and learns that friends, teamwork and imagination are what matter the most.",19.0
s4890,Movie,Pocoyo & The Space Circus,Alfonso Rodríguez,"Stephen Fry, Carys Doyle",Spain,"May 1, 2018",TV-Y,25 min,Movies,"Acrobatic aliens arrive on spaceships and perform for everyone, but when angry aliens arrive as well, Pocoyo and his friends must now put on a show.",25.0
s4891,Movie,Pocoyo Carnival,,"Stephen Fry, Alex Marty",,"May 1, 2018",TV-Y,22 min,Movies,"To celebrate the carnival, everyone learns to dance to different music. Plus, Pocoyo's friends surprise him with something delicious.",22.0
s4892,Movie,Pocoyo Halloween: Space Halloween,,"Stephen Fry, Montana Smedley",United States,"May 1, 2018",TV-Y,40 min,Movies,Pocoyo and his friends have a costume contest to celebrate Halloween and learn new things about planets and stars in space.,40.0
s4893,Movie,Pocoyo Halloween: Spooky Movies,,"Stephen Fry, Montana Smedley",,"May 1, 2018",TV-Y,22 min,Movies,"Pocoyo finds a special toy and plays new games with his friends, then they’re spooked by a scary box and try to find out who’s inside.",22.0
s4894,Movie,Pocoyo Special Sports,"Guillermo Garcia, David Cantolla",,,"May 1, 2018",TV-Y,24 min,Movies,"Everyone is getting excited for the games. Pocoyo plays baseball and golf, and races with his friends. Ready, set, go!",24.0
s4943,Movie,"Power Rangers Samurai: Christmas Together, Friends Forever (Christmas Special)",,"Alex Heartman, Erika Fong, Hector David Jr., Najee De-Tiege, Brittany Anne Pirtle, Steven Skyler, Rene Naufahu, Felix Ryan, Paul Schrier",United States,"January 1, 2016",TV-Y7,24 min,Movies,"On Christmas Eve, as the teens at Shiba House reflect on their first year together, they get an unexpected lesson on the true spirit of the holidays.",24.0
s4945,Movie,Power Rangers Samurai: Party Monsters (Halloween Special),,"Alex Heartman, Erika Fong, Hector David Jr., Najee De-Tiege, Brittany Anne Pirtle, Steven Skyler, Rene Naufahu, Felix Ryan, Paul Schrier, Ricardo Medina Jr.",United States,"January 1, 2016",TV-Y7,24 min,Movies,"On Halloween night, the creepiest creatures from the Netherworld trade war stories about their battles with the Samurai Power Rangers.",24.0
s4949,Movie,Power Rangers Super Samurai: Stuck on Christmas,,"Alex Heartman, Najee De-Tiege, Hector David Jr., Erika Fong, Brittany Anne Pirtle, Steven Skyler, Paul Schrier, Felix Ryan, Jeff Szusterman, Stig Alred, Kate Elliot",United States,"January 1, 2016",TV-Y7,24 min,"Children & Family Movies, Sci-Fi & Fantasy",The Samurai Rangers get stuck in the Megazord's cockpit on Christmas Eve when it breaks down. Can the Rangers get out in time for Christmas?,24.0
s4950,Movie,Power Rangers Super Samurai: Trickster Treat,,"Alex Heartman, Najee De-Tiege, Hector David Jr., Erika Fong, Brittany Anne Pirtle, Steven Skyler, Rene Naufahu, Paul Schrier, Felix Ryan, Jeff Szusterman, Stig Alred, Kate Elliot",United States,"January 1, 2016",TV-Y7,23 min,Movies,"When a Nighlok invades the Samurai Rangers' dreams and turns them into nightmares, the Rangers must figure out what is reality and what is illusion.",23.0
s4956,Movie,Power Rangers: Megaforce: Raising Spirits,,"Andrew M. Gray, John Mark Loudermilk, Ciara Hanna, Azim Rizk, Christina Masterson, Shailesh Prajapati, Ian Harcourt",United States,"January 1, 2016",TV-Y7,24 min,Children & Family Movies,"On Halloween, the scariest night of the year, the Rangers have a strange encounter with a mysterious medium who conjures ""visions"" of monsters past.",24.0
s4957,Movie,Power Rangers: Megaforce: The Robo Knight Before Christmas,James Barr,"Andrew M. Gray, Ciara Hanna, John Mark Loudermilk, Christina Masterson, Azim Rizk, Shailesh Prajapati, Ian Harcourt",United States,"January 1, 2016",TV-Y7,24 min,Children & Family Movies,Robo Knight learns the meaning of Christmas from a group of children when he is mistaken for a donated Christmas toy and is shipped to a foreign land.,24.0
s4962,Movie,Prem Ratan Dhan Payo,Sooraj R. Barjatya,"Salman Khan, Sonam Kapoor, Anupam Kher, Neil Nitin Mukesh, Sanjay Mishra, Swara Bhaskar, Deepak Dobriyal, Arman Kohli, Manoj Joshi, Samaira Rao, Karuna Pandey, Sucheta Khanna",India,"June 25, 2020",TV-14,164 min,"Action & Adventure, Dramas, International Movies","While recovering from an assassination attempt four days prior to his coronation, a stern prince is replaced by a joyful and generous doppelgänger.",164.0
s4975,Movie,Prince of Peoria: A Christmas Moose Miracle,Jon Rosenbaum,"Gavin Lewis, Theodore Barnes, Shelby Simmons, Cynthia Kaye McWilliams",United States,"December 17, 2018",TV-G,29 min,"Children & Family Movies, Comedies","Teddy's never missed the Festival of Lights, but the bowling alley’s been snowed in! Not to worry – Emil insists the Christmas moose will save the day.",29.0
s4982,Movie,Professor,Lekh Tandon,"Shammi Kapoor, Kalpana, Lalita Pawar, Parveen Choudhary, Salim, Pratima Devi, Rashid Khan, Bir Sakuja, Bela Bose, Ratnamala",India,"July 1, 2017",TV-PG,163 min,"Comedies, Dramas, International Movies",A college grad in need of money must disguise himself as an old man to tutor two young women who are under the watchful eye of their strict aunt.,163.0
s5001,Movie,Pukar,Rajkumar Santoshi,"Anil Kapoor, Madhuri Dixit, Namrata Shirodkar, Danny Denzongpa, Om Puri, Kulbhushan Kharbanda, Farida Jalal, Shivaji Satham",India,"March 1, 2018",TV-14,165 min,"Action & Adventure, Dramas, International Movies",A notorious terrorist manipulates an Indian army major's jilted lover into helping him obtain a classified military code.,165.0
s5004,Movie,Punjab 1984,Anurag Singh,"Diljit Dosanjh, Kiron Kher, Sonam Bajwa, Pavan Malhotra, Rana Ranbir, Vishwas Kini, Manav Vij, Vansh Bhardwaj","Canada, India","November 1, 2017",TV-14,158 min,"Dramas, International Movies","During a time of political turmoil, a mother goes on a journey in search of her missing son, who has been misjudged and labeled a terrorist.",158.0
s5012,Movie,Puss in Book: Trapped in an Epic Tale,"Roy Burdine, Johnny Castuciano","Eric Bauza, Jayma Mays, Maria Bamford, Jeff Bennett, Grey Griffin, Carla Jimenez, Paul Rugg, Joshua Rush",United States,"June 20, 2017",TV-Y7,24 min,"Children & Family Movies, Comedies","After tumbling into a magic storybook, Puss in Boots must fight, dance and romance his way through wild adventures as he searches for an escape.",24.0
s5023,Movie,Qila,Umesh Mehra,"Dilip Kumar, Mukul Dev, Rekha, Mamta Kulkarni, Smita Jaykar, Gulshan Grover",India,"June 1, 2017",TV-14,161 min,"Dramas, International Movies","When an abusive landowner is murdered, his twin brother sets out to find the killer but quickly discovers that everyone, it seems, wanted him dead.",161.0
s5048,Movie,Raajneeti,Prakash Jha,"Ajay Devgn, Nana Patekar, Ranbir Kapoor, Katrina Kaif, Arjun Rampal, Manoj Bajpayee, Sarah Thompson, Naseeruddin Shah",India,"August 2, 2018",TV-14,162 min,"Dramas, International Movies, Thrillers","When the American-educated scion of a powerful Indian family returns to the subcontinent, his first taste of power starts him down a corrupt path.",162.0
s5078,Movie,Raja Hindustani,Dharmesh Darshan,"Aamir Khan, Karisma Kapoor, Suresh Oberoi, Johnny Lever, Navneet Nishan, Veeru Krishnan, Kunal Khemu, Pramod Moutho, Mohnish Bahl",India,"May 1, 2017",TV-14,177 min,"Dramas, International Movies, Romantic Movies","When a poor taxi driver falls in love with a wealthy young woman, he must stand up to her family and contend with his own insecurities.",177.0
s5088,Movie,"Ram Dass, Going Home",Derek Peck,Ram Dass,United States,"April 6, 2018",TV-14,32 min,"Documentaries, Faith & Spirituality","From his home on Maui, pioneering researcher, author and spiritual teacher Ram Dass reflects on love, life and death as his own days draw to a close.",32.0
s5090,Movie,Ram Teri Ganga Maili,Raj Kapoor,"Mandakini, Rajiv Kapoor, Divya Rana, Saeed Jaffrey, Kulbhushan Kharbanda, Raza Murad, Sushma Seth, Trilok Kapoor",India,"December 31, 2019",TV-14,178 min,"Classic Movies, Dramas, International Movies","Abandoned by her new husband and father of her son, a mountain woman journeys to Calcutta to find him, constantly tested by social evils along the way.",178.0
s5098,Movie,Rang De Basanti,Rakeysh Omprakash Mehra,"Aamir Khan, Siddharth, Atul Kulkarni, Sharman Joshi, Kunal Kapoor, Alice Patten, Soha Ali Khan, Waheeda Rehman, Kiron Kher, Om Puri, Anupam Kher, Madhavan",India,"August 2, 2018",TV-14,159 min,"Dramas, International Movies",An idealistic English filmmaker casts a group of student actors in her docudrama about India's revolution against British rule in the 1920s.,159.0
s5109,Movie,Raya and Sakina,Hussein Kamal,"Suhair El-Babili, Shadia, Abdel Moneim Madbouly, Ahmed Bedir",,"May 21, 2020",TV-14,230 min,"Comedies, Dramas, International Movies","When robberies and murders targeting women sweep early 20th-century Egypt, the hunt for suspects leads to two shadowy sisters. Based on a true story.",230.0
s5141,Movie,Refugee,"Clementine Malpas, Leslie Knott","Cate Blanchett, Lynsey Addario, Omar Victor Diop, Graciela Iturbide, Martin Schoeller, Tom Stoddart",,"March 10, 2017",TV-PG,24 min,Documentaries,Five acclaimed photographers travel the world to provide detailed insight into the difficult conditions faced by refugees who dream of a better life.,24.0
s5173,Movie,Resurface,"Josh Izenberg, Wynn Padula",,United States,"September 1, 2017",TV-MA,28 min,"Documentaries, Sports Movies",A suicidal war veteran finds like-minded souls in a surf therapy program that helps traumatized soldiers heal while riding the waves.,28.0
s5197,Movie,Ricardo O'Farrill: Abrazo navideño,"Raúl Campos, Jan Suter","Ricardo O'Farrill, Carlos Ballarta, Sofía Niño de Rivera, Chumel Torres, Marissa ""Chabe"" Lozano",Mexico,"December 12, 2016",TV-MA,31 min,Stand-Up Comedy,"The expressive Ricardo O'Farrill uses his astute comedic sensibilities to tease Christmas traditions, and not even Santa Claus escapes unscathed.",31.0
s5278,Movie,Room on the Broom,"Max Lang, Jani Lachauer","Simon Pegg, Gillian Anderson, Rob Brydon, Martin Clunes, Sally Hawkins, David Walliams, Timothy Spall","United Kingdom, Germany","July 1, 2019",TV-Y7,26 min,"Children & Family Movies, Independent Movies","A gentle witch with a ginger braid offers rides to a variety of animals on her increasingly crowded broom, much to her grumpy cat's chagrin.",26.0
s5280,Movie,Rooting for Roona,"Pavitra Chalam, Akshay Shankar",,India,"October 15, 2020",TV-PG,42 min,"Documentaries, International Movies","In rural India, a child with hydrocephalus gets a chance at life-changing surgery after her photos go viral. This documentary charts her journey.",42.0
s5326,Movie,Saaho,Sujeeth,"Prabhas, Shraddha Kapoor, Jackie Shroff, Chunky Pandey, Neil Nitin Mukesh, Arun Vijay, Vennela Kishore, Murli Sharma, Lal, Prakash Belawadi, Mahesh Manjrekar, Tinnu Anand",India,"December 8, 2019",TV-14,172 min,"Action & Adventure, International Movies","In a fictional megalopolis, a stunning underworld theft triggers a fierce power struggle among the gangsters, with an enigmatic cop on their trail.",172.0
s5347,Movie,Sairat,Nagraj Manjule,"Rinku Rajguru, Akash Thosar, Arbaz Shaikh, Tanaji Galgunde, Suresh Vishwakarma",India,"April 1, 2018",TV-14,173 min,"Dramas, International Movies, Romantic Movies","When two college students – a rich man’s daughter and a fisherman’s son – defy social edicts by falling in love, violence erupts in their village.",173.0
s5352,Movie,Saladin,Youssef Chahine,"Ahmad Mazhar, Salah Zo El Faqqar, Nadia Lotfi, Hamdy Gheith, Laila Fawzy, Omar El-Hariri, Laila Taher, Hussein Riad, Mahmoud El Meleigy, Zaki Tolaimat",Egypt,"June 18, 2020",TV-MA,194 min,"Action & Adventure, Classic Movies, Dramas",The Sultan of Egypt and Syria launches a campaign to retake Jerusalem amid the Crusades.,194.0
s5361,Movie,Sam Kinison: The Scream Continues,,Sam Kinison,United States,"December 31, 2018",TV-MA,29 min,Documentaries,Sam's brother and former manager Bill Kinison speaks about the late comedian's journey from preacher to standup legend.,29.0
s5372,Movie,San Pietro,John Huston,,United States,"March 31, 2017",TV-14,32 min,"Classic Movies, Documentaries","After the Allies invade Italy, the Liri Valley town of San Pietro becomes an example of the brutal effects of combat, both for soldiers and civilians.",32.0
s5377,Movie,Sangam,Raj Kapoor,"Raj Kapoor, Vyjayanthimala, Rajendra Kumar, Lalita Pawar, Achala Sachdev, Hari Shivdasani, Raj Mehra, Iftekhar",India,"December 31, 2019",TV-14,228 min,"Classic Movies, Dramas, International Movies","Returning home from war after being assumed dead, a pilot weds the woman he has long loved, unaware that she had been planning to marry his best friend.",228.0
s5378,Movie,Sanju,Rajkumar Hirani,"Ranbir Kapoor, Vicky Kaushal, Paresh Rawal, Sonam Kapoor, Dia Mirza, Jim Sarbh, Anushka Sharma, Manisha Koirala, Boman Irani",India,"October 15, 2018",TV-MA,159 min,"Dramas, International Movies","From the depths of addiction to the heights of stardom to underworld entanglements, this biopic traces the checkered past of Indian actor Sanjay Dutt.",159.0
s5396,Movie,Sarkar,A.R. Murugadoss,"Vijay, Varalakshmi Sarathkumar, Keerthi Suresh, Radha Ravi, Pala Karuppaiah, Yogi Babu",,"March 2, 2019",TV-MA,162 min,"Action & Adventure, Dramas, International Movies",A ruthless businessman’s mission to expose electoral fraud brings him into a heated and dangerous political conflict with two corrupt ministers.,162.0
s5422,Movie,Sayed the Servant,Hussein Kamal,"Adel Imam, Omar El-Hariri, Raja Al-Jeddawi, Mostafa Mitwali, Moshira Ismail, Badr Nofal",,"May 21, 2020",TV-14,173 min,"Comedies, International Movies","While running from the law, Sayed begins to work as a house servant to a wealthy family, whose divorced daughter enlists his help in a marriage scheme.",173.0
s5431,Movie,Schindler's List,Steven Spielberg,"Liam Neeson, Ben Kingsley, Ralph Fiennes, Caroline Goodall, Jonathan Sagall, Embeth Davidtz, Małgorzata Gebel, Shmulik Levy, Mark Ivanir, Beatrice Macola, Friedrich von Thun, Andrzej Seweryn",United States,"April 1, 2018",R,195 min,"Classic Movies, Dramas","Oskar Schindler becomes an unlikely humanitarian, spending his entire fortune to help save 1,100 Jews from Auschwitz during World War II.",195.0
s5538,Movie,Shakti: The Power,Krishna Vamshi,"Karisma Kapoor, Nana Patekar, Sanjay Kapoor, Shah Rukh Khan, Deepti Naval, Vijay Raaz, Tiku Talsania, Jaspal Bhatti, Divya Dutta, Prakash Raj",India,"March 1, 2018",TV-MA,168 min,"Dramas, International Movies, Thrillers",A young mother must break free of the clutches of her husband's feudal family and bring herself and her young child to safety.,168.0
s5548,Movie,Shaun the Sheep: The Farmer’s Llamas,Jay Grace,"Justin Fletcher, John Sparkes, Sean Connolly, Chris Grimes",United Kingdom,"December 22, 2020",TV-Y,28 min,"Children & Family Movies, Comedies","A trio of mischievous llamas from the county fair start making a mess of the farm, so Shaun and the flock must find a way to boot out the troublemakers.",28.0
s5565,Movie,Shikari,"Latif Faiziyev, Umesh Mehra","Mithun Chakraborty, Naseeruddin Shah, Irina Kushnareva, Varsha Usgaonkar, Gulshan Grover, Anjana Mumtaz, Amrish Puri, Amrit Pal, Achyut Potdar, Lilliput","India, Soviet Union","December 8, 2017",TV-14,163 min,"Dramas, International Movies, Music & Musicals","When Shankar, who performs on the road with partner Chanchal and elephant Appu, falls for a Russian circus performer, jealousies and conflicts arise.",163.0
s5571,Movie,Shiva,Ram Gopal Varma,"Nagarjuna Akkineni, Amala, Rajendranath Zutshi, Raghuvaran, Paresh Rawal, Brij Gopal, J.D. Chakravarthi, Tanikella Bharani",India,"December 31, 2019",TV-MA,168 min,"Action & Adventure, Dramas, International Movies","A young man enrolls at a college and becomes a rival to the student-union president, who’s using force and intimidation to advance his criminal agenda.",168.0
s5606,Movie,Silent,"Limbert Fabian, Brandon Oldenburg",,United States,"June 4, 2019",TV-Y,3 min,"Children & Family Movies, Sci-Fi & Fantasy","""Silent"" is an animated short film created by Academy Award® winning Moonbot Studios. It celebrates how storytellers, inventors, and technology work together to create cinema magic.",3.0
s5625,Movie,Singapore,Shakti Samanta,"Shammi Kapoor, Padmini, Maria Menado, Shashikala, Agha, K.N. Singh, Madan Puri, Helen","India, Malaysia","October 15, 2017",TV-PG,158 min,"Comedies, Dramas, International Movies","When his employee disappears in Singapore, Shyam travels from India to investigate the absence and becomes entangled in a deadly plot.",158.0
s5644,Movie,Sitara: Let Girls Dream,Sharmeen Obaid-Chinoy,,"Pakistan, United States","March 8, 2020",TV-PG,16 min,"Children & Family Movies, Dramas","In this silent short set in 1970s Pakistan, 14-year-old Pari longs to be a pilot, unaware that her father plans to marry her off to a much older man.",16.0
s5694,Movie,Sohni Mahiwal,"Latif Faiziyev, Umesh Mehra","Zeenat Aman, Pran, Tanuja, Poonam Dhillon","India, Soviet Union","September 1, 2017",TV-14,160 min,"Dramas, International Movies, Romantic Movies","After being violently separated from the woman he loves, a young man must disguise himself in order to keep meeting her.",160.0
s5695,Movie,Sol Levante,Akira Saitoh,,Japan,"April 2, 2020",TV-14,5 min,"Action & Adventure, Anime Features, International Movies",A young warrior and her familiar search for the sacred place said to fulfill wishes. It's best not to anger the ancient guardians and spirits.,5.0
s5766,Movie,Splatter,Joe Dante,"Corey Feldman, Tony Todd, Tara Leigh, Erin Way, Mark Alan, Stuart Pankin",United States,"November 18, 2009",TV-MA,29 min,Horror Movies,"After committing suicide, a washed-up rocker returns from the grave to torment the five people who betrayed him in life.",29.0
s5794,Movie,StarBeam: Halloween Hero,Jon Izen,"Nahanni Mitchell, Dean Petriw, Terry Klassen, Sam Vincent, Rhona Rees, Laara Sadiq",Canada,"October 6, 2020",TV-Y,33 min,Children & Family Movies,"Greedy Captain Fishbeard is stealing everybody's Halloween treats for himself, but StarBeam and Boost have some tricks up their sleeves to save the day!",33.0
s5808,Movie,Steam Team to the Rescue,Joey So,"Joseph May, Keith Wickham, Yvonne Grundy, Jules De Jongh, Rachael Louise Miller, Rob Rackstraw, Christopher Ragland, Kerry Shale, Teresa Gallagher, Bob Golding",,"March 15, 2020",TV-Y,23 min,Children & Family Movies,Thomas and the steam trains spring into action when Porter and the diesel engines run into a series of accidents that throw their deliveries off track.,23.0
s5864,Movie,Sturgill Simpson Presents Sound & Fury,"Jumpei Mizusaki, Koji Morimoto, Michael Arias, Masaru Matsumoto, Arthell Isom, Henry Thurlow, Takanobu Mizuno, Elsa Nakamichi, Hajime Sasaki, Shinji Takagi",,United States,"September 27, 2019",TV-MA,42 min,"Anime Features, Music & Musicals, Sci-Fi & Fantasy","In this anime visual album, a mysterious driver heads deep into a postapocalyptic hellscape toward a ferocious showdown with two monstrous opponents.",42.0
s5891,Movie,Super Deluxe,Thiagarajan Kumararaja,"Vijay Sethupathi, Fahadh Faasil, Samantha Ruth Prabhu, Ramya Krishnan, Mysskin, Gayathrie, Ashwanth Ashok Kumar, Bagavathi Perumal",India,"June 29, 2019",TV-MA,176 min,"Comedies, Dramas, International Movies","Sex, stigma and spirituality merge in these eccentric stories of an angsty teenager, an unfaithful wife and a transgender woman returning to her past.",176.0
s5894,Movie,Super Monsters and the Wish Star,Jacob Joice,"Elyse Maloway, Vincent Tong, Erin Mathews, Andrea Libman, Alessandro Juliani, Nicole Anthony, Diana Kaarina, Ian James Corlett, Britt McKillip, Kathleen Barr, Gigi Saul Guerrero",,"December 7, 2018",TV-Y,28 min,Children & Family Movies,"Christmas wishes come true for Lobo, whose favorite cousin arrives for a surprise visit, and for Glorb, who wishes he could be everywhere at once!",28.0
s5895,Movie,Super Monsters Back to School,,"Elyse Maloway, Vincent Tong, Erin Matthews, Andrea Libman, Alessandro Juliani, Nicole Anthony, Diana Kaarina, Gigi Saul Guerrero, Ian James Corlett, Britt McKillip, Kathleen Barr",Canada,"August 16, 2019",TV-Y,24 min,Children & Family Movies,"The Super Monsters welcome Vida to her new home in Pitchfork Pines with a tour of their favorite places, then help her through her first day at school.",24.0
s5899,Movie,Super Monsters Save Christmas,Steve Ball,"Elyse Maloway, Vincent Tong, Erin Mathews, Andrea Libman, Alessandro Juliani, Nicole Anthony, Diana Kaarina, Ian James Corlett, Britt McKillip, Kathleen Barr, Gigi Saul Guerrero, Brian Drummond",United States,"November 26, 2019",TV-Y,24 min,Children & Family Movies,"It's Christmas Eve in Pitchfork Pines, and the Super Monsters are joining forces to deck the halls, find Santa's missing reindeer and save the holiday!",24.0
s5900,Movie,Super Monsters Save Halloween,,"Elyse Maloway, Vincent Tong, Erin Matthews, Andrea Libman, Alessandro Juliani, Nicole Anthony, Diana Kaarina, Ian James Corlett, Britt McKillip, Kathleen Barr",,"October 5, 2018",TV-Y,25 min,Children & Family Movies,"The Super Monsters use their powers to get their neighbors in the Halloween spirit, then help a nervous friend see there's nothing to be afraid of.",25.0
s5901,Movie,Super Monsters: Dia de los Monsters,,,Canada,"October 9, 2020",TV-Y,25 min,Children & Family Movies,"The Super Monsters celebrate Día de los Muertos in Vida’s hometown with her magical family, some new monster friends and a spook-tacular parade!",25.0
s5902,Movie,Super Monsters: Santa’s Super Monster Helpers,Steve Ball,"Elyse Maloway, Vincent Tong, Erin Mathews, Andrea Libman, Alessandro Juliani, Nicole Anthony, Diana Kaarina, Gigi Saul Guerrero, Rukiya Bernard, Asia Mattu, Elicia MacKenzie",,"December 8, 2020",TV-Y,24 min,Children & Family Movies,"When Santa needs serious help prepping all of his presents, the Super Monsters lend a hand — and some monster magic — to get every gift out on time!",24.0
s5903,Movie,Super Monsters: The New Class,Steve Ball,"Elyse Maloway, Vincent Tong, Erin Mathews, Andrea Libman, Alessandro Juliani, Nicole Anthony, Diana Kaarina, Gigi Saul Guerrero, Asia Mattu, Rukiya Bernard, Elicia MacKenzie, Ian James Corlett, Britt McKillip",Canada,"August 1, 2020",TV-Y,25 min,Children & Family Movies,"A new class of pint-sized preschoolers arrives at Pitchfork Pines, and the Super Monsters take their superpowers to the next level — the Purple Room!",25.0
s5904,Movie,Super Monsters: Vida's First Halloween,"Jacob Joice, Steve Ball","Gigi Saul Guerrero, Elyse Maloway, Vincent Tong, Erin Mathews, Andrea Libman, Alessandro Juliani, Nicole Anthony, Diana Kaarina, Ian James Corlett, Britt McKillip, Kathleen Barr",United States,"October 4, 2019",TV-Y,24 min,Children & Family Movies,"The Super Monsters share their Halloween traditions with Vida, then get invited to a Día de los Muertos party in the Howlers' backyard.",24.0
s5933,Movie,Swades,Ashutosh Gowariker,"Shah Rukh Khan, Gayatri Joshi, Kishori Balal, Smith Seth, Lekh Tandon, Rajesh Vivek, Daya Shankar Pandey, Farrukh Jaffar",India,"March 1, 2018",TV-PG,185 min,"Dramas, International Movies",An Americanized NASA scientist returns to his native India on a business trip and searches for the nanny who helped raise him.,185.0
s5954,Movie,Taal,Subhash Ghai,"Anil Kapoor, Aishwarya Rai Bachchan, Akshaye Khanna, Amrish Puri, Alok Nath, Mita Vasisht, Saurabh Shukla, Supriya Karnik",India,"March 1, 2018",TV-PG,177 min,"Dramas, International Movies, Music & Musicals","Businessman Manav falls for aspiring singer Mansi, but their romance faces an uphill climb when Manav must depart and Mansi's suave manager moves in.",177.0
s5955,Movie,Taare Zameen Par,Aamir Khan,"Aamir Khan, Darsheel Safary, Tanay Chheda, Tisca Chopra, Vipin Sharma, Girija Oak, M.K. Raina",India,"January 10, 2021",PG,162 min,"Dramas, International Movies","When daydreamer Ishaan is sent to boarding school, an unconventional art teacher tries to help the imaginative student discover his true identity.",162.0
